path	sentence
hist140520_ye_tiane_S384.wav	tɕendɤre tɯ-ŋga ra lɤ-sthɯt-a ɕti qhe tu-rɯɕmi-a tɤ-kɯ-khɯ ŋu, 
hist-19-qachGamWntoR_S030.wav	mɤdɤmɲɤm kɤ-ti ci tu tɕe, mɤdɤmɲɤm nɯnɯ si ŋu.
hist140520_ye_tiane_S071.wav	tɕeri ɯ-pi ra wuma ʑo pjɤ-nɯmbɣom qhe, 
hist140504_huiguniang_S224.wav	"""jɤ-ɕɣɤz jɤ-ɕɣɤz nɤki jɤ-tsɯm,"
hist-25-akWzgumba_S103.wav	stɤsmɤt ju-omtɕoʁ ŋu 
hist140506_nongfu_he_mogui_S026.wav	"kɯkɯra lonba nɤʑɯɣ a-nɯ-βze"" to-ti ɲɯ-ŋu."
hist-24-ZmbrWpGa_S005.wav	aʑo ndɤre ku-rtoʁ-a ɲɯ-naχtɕɯɣ-ndʑi ɕti.
hist-14-tApitaRi_S328.wav	ɯ-me nɯ phɯrpa mtshu rmi,
hist-26-qambalWla_S076.wav	nɯnɯ sɯjno tu-ndze ɲɯ-ŋu ma ɯ-phoŋbu ra ɲɯ-ɤrŋi ʑo.
hist140515_rJama_S032.wav	ma iʑo ɣɯ po tu ri, nɯ ku-χpjat-a ri, nɯnɯ ɯ-ŋgɯ tɕe, sqɯ-χtsiɯ ɕaŋtaʁ mɯ́j-tɕhɯt.
hist140513_mutong_de_disheng_S051.wav	tɕendɤre chɤ-pɣaʁ.
hist140430_jin_e_S189.wav	"""mɯ-kɤ-rtaʁ ʑo mɤɕtʂa ku-ta-jtshi jɤɣ"" to-ti ɲɯ-ŋu. "
hist140519_mai_huochai_de_xiaonvhai_S178.wav	ɯ-wi pa-mto, nɯnɯra ko-ntɕhɤr ndʐa ɲɯ-ŋu,
hist-18-NGolo_S075.wav	tɕe nɯnɯ tɤmdzɤqaqa ŋu.
hist-22-BlamajmAG_S144.wav	ma nɯ ma si kɯ-wxti ɯ-taʁ mɤ-ndzoʁ.
hist140428_mu_e_guniang_S012.wav	tɕendɤre ɯ-me ɣɯ ʑɯmkhɤm ʑo iɕqha nɯ,
hist-14-tApitaRi_S143.wav	tɕe rɯndzɯnrcit rmi tɕe,
hist-08-tWrgi_S013.wav	puj kɤ-ti ɣɤʑu, nɤki,
hist140521_huangdi_de_xinzhuang_S076.wav	iɕqha ci nɯ, tɯtaʁ ɯ-kɯ-βzu ni kɯ tɯ-tɤ-kɤ-tɯt nɯ to-ti tɕe,
hist140427_kWmdza_stWnmW_S016.wav	tɤ-ɲi chondɤre li, nɯ ɣɯ, nɤki, ɯ-ʁi nɯ ci kú-wɣ-pamɤ-kɯ-khɯ ɲɯ-ŋu.
hist-20-kApjAt_S039.wav	khɯtsa kɯfse ɯtaʁ tu-ru ŋu tɕe nɯnɯ ɯ-taʁ nɯreri
hist140513_abide_he_mogui_S089.wav	aʑo pɯ-pɯ-ŋu nɤ, nɯnɯ aʑo a-ndʐa, aʑo ɣɯ a-ndʐa nɯ /tonɯ/ tu-onɯlɯlat-a pɯ-ŋu tɕe,
hist140426_luozi_he_qiangdao_S038.wav	tɯ-tɕhaʁ tɕɤt tu-ti ɲɯ-ŋu.
hist-25-kACAl_S026.wav	tɯ-mɲaʁ ɯ-kɯ-mŋɤm li ɕɤwɤr kɤ-ti ci tu tɕe,
hist-16-RlWmsWsi_S142.wav	tɕe ʑɯrɯʑɤri tɕe ɯ-χɕɤl ri ɯ-spjɯŋ tu-ɣi tɕe  tɕendɤre
hist-30-macha_S059.wav	tɕe pjɯ́-wɣ-ɣɟaβ
hist140512_fushang_he_yaomo1_S043.wav	si ɯ-qa nɯtɕu pɯ-amdzɯ ʑo tɕe iɕqha ɬɤndʐi nɯ ju-kɤ-ɣi pjɤ-k-ɤz-nɤjo-ci tɕe, 
hist-30-Com_S197.wav	rnɤjɯ chɯ-nɯ-βʑu-nɯ
hist140522_Kamnyu_tWji2_S092.wav	rpɤŋgɯ ri qhɤqhɤte kɤ-ti ci tu,
hist-26-NalitCaRmbWm_S085.wav	kɯki ɯ-mdoʁ ʑo ɯ-kɯ-ndo.
hist-12-Zmbroko_S112.wav	mɤʑɯ ɕoʁɕɣa kɤ-ti ci tu ri, ɯ-jwaʁ nɯra li zwɤr kɯ-fse ŋu tɕe,
hist-27-kikakCi_S103.wav	ɯ-jaʁ tɕhi nɯ-kɯ-ɣe ʑo tu-ndze (il mange tout ce qui lui tombe sous la main)
hist-16-RlWmsWsi_S033.wav	nɯnɯ tɕe, ɯ-jwaʁ nɯra ɯ-qhu ɯ-ʁɤri ra kɯ-mpɕɯ-mpɕu ʑo ŋu tɕe,
hist-19-GzW_S006.wav	si ɯ-mat ra tu-ndze ɲɯ-ɕti.
hist-28-kWpAz_S017.wav	tɕe kɯpɤz nɯ wuma ɲɯ-sɤjloʁ ma
hist-28-qapar_S128.wav	ɯʑo sɤznɤ ɯ-jme zri.
hist-11-qarGW_S127.wav	tɕe nɯnɯ mɤ-naχtɕɯɣ-ndʑi.
hist-19-rNamoN_S046.wav	tɕeri iɕqha qambɯt sɤtɕha nɯtɕu, 
hist-26-NalitCaRmbWm_S118.wav	tɕe nɯnɯ sɯjno mbrɯmbro  ŋu.
hist-12-ndZiNgri_S202.wav	tɕe ʑɴɢoloʁ nɯ nɯ kɯ-fse ŋu.
hist-X1slobdpon_S347.wav	nɯ-lni-nɯ ʑo pjɤ-rɤʑi-nɯ ri 
hist-08-qaJAGi_S012.wav	tɕeri ɯ-jwaʁ ɯ-taʁ tɕe ɯ-rme tu
hist-18-qromJoR_S079.wav	qarɣɤpɤt ɯ-rca ri kɯnɤ tu-ɬoʁ ɲɯ-ŋu.
hist140515_jiesu_de_laoren_S077.wav	tɕendɤre ɯ-tɯ-rga pjɤ-saχaʁ ʑo ma,
hist140506_shizi_he_huichang_huichang_de_bailingniao_S185.wav	"""ɯnɯnɯ ʁloŋ nɯnɯ nɤkinɯ, iɕqha nɯ,"
hist-13-tApWpjoR_S037.wav	tɕe nɯnɯ tapɯpjoʁ chondɤre kɯnɯmar nɯ ŋu tɕe,
hist-30-mboR_S049.wav	tɯ-ndʐi ʁɟa ma maŋe.
hist-24-kWmu_S064.wav	tɕe tɤ-kɤ-rɤt ʑo fse ma ɯ-muj nɯra wuma ʑo mpɕɤr, khatoʁ ʑo tu. 
hist140521_huangdi_de_xinzhuang_S214.wav	tɕe nɯ kɯ-fse tɕe pjɤ-jɤɣ.
hist140428_yonggan_de_xiaocaifeng_S063.wav	tɕetu nɤmkha, tɯmɯ nɤmkha nɯ tɕu to-ɣɤrɤt ri rca, tɕetutu ʑo to-sɯxɕe tɕe,
hist-30-rkAsnom_S019.wav	tɕe jinde rkɤsnom cho mɯ-pjɤ-naχtɕɯɣ
hist-05-paR_S078.wav	iʑora kɯ tɕe tɤse, paʁ ɣɯ tɯrdoʁ ɣɯ ɯse nɯnɯ
hist-26-mYaRmtsaR_S104.wav	tɕe ɴɢoɕna me, porɤt me,
hist140510_sanpian_yumao_S118.wav	nɯ kɯ-fse ʑo ku-nɤmtɕɯrlɯr-ndʑi qhe ɣɤrɣɤr ʑo pjɤ-pa-ndʑi, pjɤ-khe-ndʑi ʑo kɯ-fse ma maka, iɕqha nɯ, kɯ-ɤrtɯm nɯ ɯ-ŋgɯ ku-ɕe-ndʑi mɯ-pjɤ-ɕha, ku-mtsaʁ-ndʑi mɯ-pjɤ-cha 
hist140506_loBzi_S006.wav	tɕe kha ɯ-pa tɕe ɯ-kɯ-nɤjo pjɤ-ɣi ri,
hist140430_jin_e_S004.wav	tɕe ndʑi-tɕɯ nɯ χsɯm pjɤ-tu tɕe, tɕendɤre,
hist-26-mYaRmtsaR_S085.wav	ma nɯnɯ ɴɢoɕna, ɯ-thoʁ ɴɢoɕna ci tu.
hist140511_alading_yu_shendeng_S209.wav	ɯ-xɕɤt tɯ-tu ʑo to-ti.
hist140504_baixue_gongzhu_S171.wav	ɯ-grɤl kɯ-me a-mɤ-tɤ-tɯ-ntɕhoz ma mɯ́j-pe to-ti-nɯ.
hist140506_woju_guniang_S077.wav	"tɕheme sŋaʁspa nɯ ""tu-ɕe-a"" na-sɯso tɕe tɕendɤre, "
hist140521_huangdi_de_xinzhuang_S161.wav	tɕeri nɯra ɯ-zda nɯra kɯnɤ to-ti-nɯ,
hist140519_yeying_S030.wav	tɕendɤre /ɯs/ nɤkinɯ, rɟɤlkhɤβ raŋri ɣɯ nɯnɯ, kɯ-nɤŋkɯŋke kɯ-nɤmɲole ju-kɯ-ɣi nɯra kɯ, tɕe kukutɕu iɕqha nɤki, rɟɤlpu nɯ ɣɯ ɯ-kha nɯtɕu ju-ɣi-nɯ tɕe,
hist140510_rkoNJAl_S067.wav	tɯ-ɣjɤn tɕe, ɯ-nmaʁ nɯnɯ ŋotɕu jɤ-ari ŋu ma ɲɤ-nɯrmɯ tɕe,
hist-13-tApWpjoR_S055.wav	nɯnɯ ɣɯ ɯ-mnɯ tu-kɯ-ɣi nɯnɯra tɕe ndʑu ɲɯ́-wɣ-nɯ-βzu sna,
hist140511_yiqianlingyiye_yinzi_S051.wav	"tɕendɤre, tɕe nɯnɯ rcanɯ koŋla nɤ-kɤ-nɯrga fɕat-a"" to-ti."
hist140427_qamtsWrmdzu_S011.wav	tɕe nɯ qamtsɯrmdzu tu-kɯ-ti ŋu.
hist-22-qAjdo_S070.wav	tɕe nɤkinɯ, nɯ kɯmaʁ ci li kɯ-xtɕi tsa ci tu tɕe,
hist-17-thowum_S005.wav	tɕeri ɯ-si nɯ sna me,
hist-21-lWlu_S027.wav	nɯ maʁ nɤ, lɯlu a-pɯ-me rcanɯ, βʑɯ ɯ-kha tɕe ɯ-tɯ-rɯŋɯŋɤn kɯ 
hist-X1slobdpon_S255.wav	"""nɤʑo nɯ kɯ-fse mɤ-kɯ-naχtɕɯɣ, nɯ mɤɕtʂa //tɯte// mɯ-pɯ-mto-t-a tɕe, mɤ-kɯ-naχtɕɯɣ ci ɲɯ-tɯ-ɕti tɕe, "
hist-22-BlamajmAG_S032.wav	nɯ ɣɯ ɯ-sɤtɕha nɯre tu-ɬoʁ ŋu.
hist140514_huishuohua_de_niao_S204.wav	tɯ-ci nɯ pjɤ-lɤt tɕe tɕendɤre ɯ-pi ni /to/ to-sɯsu-ndʑi.
hist-27-kikakCi_S090.wav	sɯŋgi cho rɟaspa ɲɯ-naχtɕɯɣ-ndʑi ri,
hist-26-kWrNukWGndZWr_S095.wav	ma nɯnɯ ɲɯ-mbaʁ tɕe tɕe ɯ-rqhu nɯnɯre ɲɯ-βde ɲɯ-ŋu.
hist140522_Kamnyu_tWji2_S058.wav	tɕe nɯnɯ χpɯnʑaŋ ŋu
hist-27-tWCGArgu_S056.wav	sqamnɯ-pɤrme ɯ-taʁ thɯ-kɯ-ɤzɣɯt tɕe, tɕe tɯ-ɕɣa nɯ nɯ-mbɯt kɯnɤ kɤ-nɤsci me.
hist-20-RmbroN_S086.wav	pa kɯ-fse ri ɯ-ʁrɯ pjɯ-ɬoʁ qhe, tɕe ɯ-phaʁ ntsi ri tu-ɣi qhe,
hist140426_nWNa_ra_nWrmi_S024.wav	nɤki skɤtɤthɤr low, ɬartsi low, nɯra tu-kɯ-ti khɯ.
hist-21-jmAGni_S036.wav	tɯrgi kɯ-ɤrmbat kɯ-fse stɤmku nɯra ɬoʁ ma
hist-24-qro_S074.wav	ɯ-phoŋbu nɯ nɯ sthɯci mɯ́j-wxti nɯ.
hist140511_xinbada_hanghai_lixianji_S059.wav	tɕe nɯnɯ nɯnɯ mɯ-nɯ-si mɤɕtʂa ɯ-kɤ-ndza ɯ-spa.
hist140522_Kamnyu_tWji_S045.wav	lu-ji-nɯ qhe ɯ-nɤpɯpa tu-ɣɤβdi-nɯ, 
hist-25-zrW_S021.wav	ma nɯnɯ, nɯnɯ zrɯ nɯ tɯ-rdoʁ kɤ-tɕɤt a-pɯ-kɯ-cha tɕe
hist-14-tasa_S019.wav	tasa ɯ-ŋgɯ nɯ tɕu, tasɤɣʑa nɯ chɯ́-wɣ-ntshi.
hist140428_mtshalu_kAsAla_S040.wav	tɕe nɯnɯ ɯ-ŋgɯ nɯ tɕu mɤʑɯ ɯ-xiangliao tɕhi tɯ-kɤ-rga nɯ lú-wɣ-lɤt tɕe.
hist140520_ye_tiane_S388.wav	tɕendɤre ɯ-pi nɯ kɯ nɯra pɯ-pɯ-kɯ-fse nɯ lonba ʑo pjɤ-fɕɤt tɕe, nɤki,
hist140512_yufu_yu_mogui_S082.wav	"tɕeri ɣurʑa-xpa tɤ-tsu ri, nɯnɯ a-kɯ-fsraŋ pɯ-me."" to-ti."
hist140519_mai_huochai_de_xiaonvhai_S134.wav	nɯra to-ti tɕe tɕendɤre,
hist-28-kWpAz_S033.wav	ɯ-rqhu kɯ-tu kɯ-rko nɯ ɲɯ-βze ɲɯ-ŋu.
hist-13-NAnWkWmtsWG_S146.wav	tɕendɤre ʑɯrɯʑɤri tɕe tɕe ki tu-fse tɕe ɲɯ-rle ɲɯ-ŋu.
hist140429_qingwa_wangzi_S183.wav	wuma ʑo /nɤki/  tɯtɯrca kɤ-ɤnɯɣro tɕe
hist-20-sWNgi_S084.wav	ma nɯnɯ, nɤkinɯ, zhuanjia nɯ kɯ pjɯ-fɕɤt-nɯ ɲɯ-ŋu.
hist140511_alading_yu_shendeng_S039.wav	"wo nɯ fse mɯ-nɯ-sɯso-t-a ri"" nɯra to-ti tɕe,"
hist140510_sanpian_yumao_S081.wav	ʑɤni kɯ ja-ɣɯt-ndʑi, jiezhi nɯnɯ ɯ-xso tɯrme ra kɯ lu-nɯ-rʁe-nɯ kɯ-fse nɯ pjɤ-ɕti ma
hist-29-mWBZi_S100.wav	ʁmbɣɯzɯn kɤ-ti ci tu tɕe, nɯnɯ, nɤki
hist140430_jin_e_S139.wav	slɤβkhaŋ ɣɯ nɯ-kɯ-rɤma nɯ kɯ, iɕqha nɯ, iɕqha rgɤtpu nɯnɯ,
hist140513_shenqi_de_feitan_S170.wav	kɤsɯfse kɯ kɯ-xtɕi kɯ-wxti kɯ ʑo ɲɤ-ɕar-nɯ ri,
hist140508_benling_gaoqiang_de_si_xiongdi_S224.wav	tɕendɤre nɤkinɯ iɕqha nɯ, nɯʑora kɯ nɯnɯ, nɤkinɯ, a-me nɯ-rʑaβ kɤ-ɕar, nɤkinɯ iɕqha nɯ, ɲɯ-tɯ-βde-nɯ pɯ-pɯ-khɯ nɤ, 
hist140427_shuizhao_de_gou_yu_lang_S005.wav	lo-rɟɯɣ ʑo tɕe, nɤki,
hist-06-cz-Wwa_S002.wav	tshɤt cho qaʑo kɤlɤt wuma ʑo pjɤrga
hist-31-chACu_S001.wav	tɕe chɤɕu kɤ-ti ci tu.
hist140425_shizi_lang_he_huli_S029.wav	"/tɤ/ kɤ-nɯsmɤn ɯ-tshɯɣa tɕhi tú-wɣ-stu ʑo kɯ-fse kɯ-phɤn me"" to-ti ɲɯ-ŋu. (superlative)"
hist-24-zwArqhAjmAG_S028.wav	tɯji ɯ-mŋu ɯ-ndo nɯra tu, ɯ-di mnɤm.
hist-30-tWNga_S040.wav	tɕheme ɯ-ŋga chɯ́-wɣ-βzu nɯ ɕɤntsɯt tu-kɯ-ti ŋu.
hist140510_sanpian_sheye_S012.wav	nɤki rɟɤlkhɤβ ɯ-taʁ ʑo ɯ-rmi ɲɤ-mbri.
hist140425_ajimide01_S001.wav	tɕe kɯɕɯŋgɯ tɕe tɕe xila ra ɣɯ nɯ-rɟɤlpu ci pjɤ-tu.
hist-26-NalitCaRmbWm_S084.wav	kɯ-pɣi ci tu.
hist-26-qro-fourmi_S044.wav	ɯ-mɲaʁ ɲɯ-kɤ-cɯ me kɯnɤ ʑo nɯ kɯ-fse ʑo li qro nɯ tu-ndze ɲɯ-ŋu khi tɕe. 
hist140428_mu_e_guniang_S193.wav	kedejin ɣɯ ɯ-rte nɯnɯ jo-sɯtsɯm ɲɯ-ŋu.
hist-26-qro-fourmi_S032.wav	qro nɯ kɯ kɯ-sɤmtsɯɣ,
hist-28-smAnmi_S303.wav	"""wo mɤ-ʁdɯɣ, mɤ-ʁdɯɣ, tɕe tɕetha fsosoz tɯmtɕi ʑo tɕe, "
hist-20-kApjAt_S009.wav	ɯnɯnɯ iɕqha tɯkhroŋkhroŋ ɯŋgɯ ri chɯ́wɣlɤt
hist140518_mao_he_laoshu_S023.wav	tɕendɤre nɯnɯ kɯ-spoʁ nɯ ɣɯ ɯ-kɯm nɯ chɤ-sɯsti tɕe, tɕendɤre,
hist-30-CnAto_S047.wav	pjɯ-nɤrkhɯβrkhɯβnɯ tɕe  tɕe
hist140516_huli_de_baofu_S092.wav	ɕlaʁ ʑo pjɤ-sɯso ri, nɯ li ɯ-βlu ci to-tu tɕe,
hist-23-mbrAZWm_S139.wav	tɕe kachijmɤɣ ɣɯ ɯ-ru nɯnɯ 
hist-26-mYaRmtsaR_S160.wav	ɯ-mɤlɤjaʁ nɯra kɯnɤ ɯ-rme ɣɤʑu.
hist-X1-qachGa_S118.wav	ɯ-mgɯrqhu a-tɤ-tɯ-ɕe tɕe tɕe, nɤki
hist140517_buai_shuohua_de_gongzhu_S109.wav	"ma nɯni kɯnɤ ""tɕiʑɤɣ kɯnɤ, nɯnɯ tɕheme nɯ ɲɯ-mpɕɤr tɕe tɕiʑɤɣ ra"" to-ti-ndʑi."
hist-05-qaZo_S031.wav	nɯ kɯ-rga tu, mɤ-kɯ-rga tu
hist-21-mdzadi_S032.wav	mdʐɯɕɯɣ kɤ-ti nɯ li qajɯ ci ɲɯ-ŋu.
hist-30-Com_S192.wav	tɕe iɕqha nɯ, nɯnɯ rŋɯl ŋu, 
hist140430_yufu_he_tade_qizi_S180.wav	aʁɤndɯndɤt jɤ-kɯ-ɣe ɣɯ, nɤkinɯ, tɤru ɣɯ nɯnɯra nɯ-ftɕɤfkɤt ra pjɤ-k-ɤsɯ-tɕɤt-ci.
hist-12-Zmbroko_S073.wav	tɕe nɯnɯ smɯrqom ŋu.
hist-11-qrontshom_S037.wav	ma qarɣe nɯnɯ ɣɯ ɯ-jwaʁ kɯ-ndɯ-ndɯβ ʑo ŋu.
hist-28-qAjdo_S168.wav	li ci pjɤ-qrɯ ri, li ɯ-ŋgɯ tɯ-rdoʁ  tɕe 
hist140512_fushang_he_yaomo_S166.wav	"nɤki mbalɤpɯ nɯ ɯ-ɕki, ""/nɯ kɯ/, nɤʑo sŋaʁ pɯ-kɯ-xtsɯɣ ɣɯ tɯrme ɲɯ-tɯ-ɕti tɕe, "
hist-30-tasa_S026.wav	tɕe nɯnɯ nɤkinɯ, tɕe nɯ koʁmɯz nɤ ɲɯ́-wɣ-qrɯ tɕe lʁa chɯ́-wɣ-βzu ŋu.
hist-25-kACAl_S059.wav	ɯnɯnɯ kɯ-fse ɯ-qe ɯ-rca ri, kɤ-cu kɯ-fse ɣɤʑu.
hist-27-kikakCi_S194.wav	ri cɤmtsho ndɤre pjɯ-sɤ-sat mɤ-ŋgrɤl ri, ɯ-ndzɣi tu ŋgrɤl.
hist-08-khWjNga_S061.wav	co ɣɯ nɯnɯ kɯ mɤku ma nɯnɯtɕu kɯ ɲɯ-mpja 
hist-24-zwArqhAjmAG_S007.wav	ma aʑo ɯ-tshɯɣa nɯnɯ nɤkinɯ kɯwɣrummɤɣ cho ɲɯ-naχtɕɯɣ.
hist-11-mYAm_S075.wav	tɕe nɯnɯ li tu-mbro tɕe,
hist140516_huli_de_baofu_S102.wav	nɤʑo tɤ-ndzur, tɤ-ndzur tɕe kɤ-rɤʑi, nɤ-phoŋbu tɤ-sɤstɤkɤm, 
hist-28-qAjdo_S013.wav	"""qajdo kɯ ""pho laz tu [maʁ!] ""mo laz tu, pho laz me"" ɲɯ-ti"" to-ti."
hist-26-qro-fourmi_S086.wav	ama, cɤmi qro nɯnɯ kɯnɤ, ɯʑoz ku-nɯ-rɤʑi qhe, iɕqha
hist-07-Cku_S117.wav	tɕeri ɯ-di nɯnɯ tɤspɯɕku ɯ-di cho naχtɕɯɣ
hist-05-paR_S026.wav	tɕe paʁ ɣɯ ɯ-ɣli nɯ li tɤ-rɤku ɯ-ŋgɯ kɤ-lɤt wuma ʑo tɯ-ɣli kɯ-pe ŋu 
hist140507_jinniao_S153.wav	qale sɤz ʑo kɯ-mbjom nɯnɯ kɤ-ɕar tɯ-tɯ-cha nɤ, 
hist-04-cuiniao_S014.wav	ɯ-ku nɯtɕu, ɯ-kɤχcɤl ɣɯ, nɤki,  ɯ-muj nɯnɯ ganlanse tɕe nɤkinɯ,
hist-04-cuiniao_S049.wav	nɤki, tɯdi jɤ-kɤ-lɤt ʑo tu-fse ku-ɕe tɕe tɕendɤre, 
hist-28-qapar_S228.wav	"""hua guniang"" ra tu-nɯ-ti-nɯ ɲɯ-ŋu."
hist-28-smAnmi_S027.wav	srɯnmɯ nɯ kɯ, nɯ ma ɯ-kɤpa pjɤ-me tɕe, nɤki to-stu, 
hist140520_xiaoyida_de_huar_S064.wav	ɯnɯnɯ tɕe ʑara ɲɯ-ɲat-nɯ ɲɯ-ŋu matɕi lu-znɯfsoχspɤt-nɯ ʑo pjɯ-rɟaʁ-nɯ ɲɯ-ɕti tɕe,
hist140518_jinyin_chengbao_S032.wav	tɕendɤre, nɯnɯ rɟɤlsa ɣɯ ɯ-kɤχcɤl nɯnɯtɕu zɯ, iɕqha,
hist-08-kWmtChW_S015.wav	cɯpɤspoʁspoʁ pjɯ-ta-j tɕe tɕendɤre maŋpa nɯ βɣɤno, maŋtaʁ nɯ βɣɤtu ɯɕpɯz tɕe
hist-29-mWBZi_S088.wav	nɯ ʑŋgri ɲɯ-kɯ-mɤrʑaβ tu-ti-nɯ ŋu.
hist140504_baixue_gongzhu_S101.wav	"tɕeri, nɤkinɯ, ɯ-ɬaʁ nɯnɯ kɯ, nɤki ""ki tɤɕime ki /tɤ/ kɯ-ɣɤrʁaʁ nɯ kɯ pa-sat ŋu"" ɲɯ-sɯsɤm tɕe ɲɯ-nɯ-ʑɣɤɕɯrga tɕe ku-rɤʑi pjɤ-ŋu."
hist140512_alibaba_S286.wav	tɕendɤre alibaba nɯ kóʁmɯz nɤ, nɤki, ɯ-jmŋo ɯ-ŋgɯ thɯ-kɯ-sta ʑo pjɤ-fse matɕi,
hist-08-khWjNga_S081.wav	sɤndɤɣ tu-ti-nɯ ɲɯ-ŋu ri,
hist-20-kApjAt_S046.wav	tɕe chɯ-ŋgio ɲɯ-mbat tɕe nɯ kɯfse chɯ́wɣlɤt tɕe 
hist-27-kharwut_S039.wav	tɕeri nɯnɯ li wuma ʑo ɲɯ-thɯ.
hist140510_mYWrgAt_S022.wav	ɯ-rŋa ju-kɯ-ru ɯ-pɕoʁ nɯtɕu ntsɯ ju-kɯ-phɣo tɕe,
hist-28-CAmWGdW_S121.wav	pɯ-rɲo-t-a, minbing xunlian ri jɤ-ari-a tɕe, 
hist-09-stoR_S023.wav	tɕe nɤkinɯ, thɯmda ri tɕe tɕe chɯrko ŋu
hist140425_shizi_lang_he_huli_S034.wav	tɯʑo tɯ-phoŋbu ɯ-taʁ nɯ tɕu kú-wɣ-rtɤβ tɕe
hist140505_liuhaohan_zoubian_tianxia_S209.wav	"tɕendɤre, nɤkinɯ, tɤ-rte ɯ-kɯ-ŋga tɯrme nɯ kɯ ""wo, mɤ-ʁdɯɣ, "
hist140430_yufu_he_tade_qizi_S020.wav	rgɤtpu nɯ li kɯ-nɯqaɟy jo-ɕe tɕe, nɤki
hist-X1-qachGa_S075.wav	"tɕetha ɣɯ-nɯzdɯɣ-a-nɯ"" to-ti ɲɯ-ŋu tɕe tɕendɤre,"
hist-30-komAr_S003.wav	tɕe nɯnɯ nɤkinɯ
hist140512_yufu_yu_mogui_S079.wav	kɤ-tɕɤt kɯ-cha pɯ-pɯ-tu nɤ,
hist-20-tArka_S023.wav	tɕe tɤrka nɯ chɯ-rɤpɯ tɕhi tu-fse ŋu mɤxsi,
hist140507_jinniao_S316.wav	tɯrme ʁnɯz nɯnɯ, nɤkinɯ, pjɤ-k-ɤzgroʁ-ci, pjɤ-k-ɤzbraʁ-ci tɕe,
hist140519_mai_huochai_de_xiaonvhai_S113.wav	/tha/ ɯ-kɤ-sɯso thamtɕɤt ra nɯ-χpi pjɤ-tu qhe,
hist-20-ldWGi_S049.wav	tɕhɯsmɤn nɯnɯ iɕqha tɯ-ci kɯ-sɤɕke.
hist140507_tangguowu_S149.wav	χsɤr, χsɤr tɯ-tɤfkɯm pjɤ-mto-ndʑi.
hist140506_shizi_he_huichang_huichang_de_bailingniao_S091.wav	"ɯʑo ɯ-sɯm tɕe, nɯnɯ, nɯnɯ ʑaʑa jɤznɤ iɕqha sɯŋgi nɯ kɯ tha-ndza ɕti"" ɲɯ-sɯsɤm pjɤ-ŋu"
hist-22-BlamajmAG_S042.wav	sijmɤɣ nɯnɯ, nɤkinɯ, ɯ-tshɯɣa nɯra jmɤɣni wuma ʑo fse.
hist-25-akWzgumba_S119.wav	kɯ-jpɯ-jpum nɯra.
hist140427_dongtian_he_chuntian_S006.wav	tɕe ɕɯrɕɯr kɯ-pa mɤ-khɯ ma tɕe rcanɯ
hist-28-tshAwAre_S012.wav	tɕe nɯnɯ praʁ ɯ-taʁ kɤ-ŋke kɯ-fse,
hist140429_qingwa_wangzi_S122.wav	"nɤʑo ɣɯ nɤ-jizi ɯ-taʁ rca nɯ tɕu tu-kɯ-sɯɣe-a ɯ́-jɤɣ"" to-ti ɲɯ-ŋu."
hist140507_jinniao_S365.wav	"tɕe qachɣa kɯ, nɤki, tɤ-tɕɯ nɯ ɯ-ɕki, nɤkinɯ, ""nɤʑo iɕqha, kɯ-nɤphɯphɯ tɤ-nɯɕpɯz tɕe,"
hist-27-spjaNkW_S110.wav	qajɯ ɲɯ-nɯ-ɕar ɲɯ-ŋu. tɕe nɯnɯ βɣɯz ŋu.
hist-29-LantshAm_S054.wav	a-pɯ-jim nɤki, zdɯm a-pɯ-me, tɤtʂu a-pɯ-me tɕe tɕe sɤmto.
hist140425_ajimide01_S026.wav	χsɤr kɯ-taŋ ɣɯ ɯ-ci nɯnɯ tu-ɣi pjɤ-maʁ ɯ-ɲɯ́-ŋu?
hist-24-kWmu_S067.wav	ɯʑo ɯ-phoŋbu ɯ-tɯ-zri cho ɯ-jme ɯ-tɯ-zri nɯra naχtɕɯɣ ʑo.
hist-31-cha_S141.wav	lú-wɣ-sqa tɕe ɯ-ci kɯ-xtɕɯ-xtɕi lú-wɣ-lɤt
hist140428_xiaohongmao_S101.wav	tɕeri, nɤkinɯ, ku-rtoʁ tɕe,
hist-26-tCAkWG_S031.wav	qandʑi pjɯnɯloʁ
hist-26-kWrNukWGndZWr_S081.wav	wuma ʑo sɤɣdɯɣ, tɯ-rnoʁ ʑo ku-ci ɕti 
hist140520_ye_tiane_S156.wav	kɤndʑɯʁi ra kɤsɯfse ʑo, /kɤ́nɯ/ yilisha cho lonba ʑo,  
hist140428_yonggan_de_xiaocaifeng_S221.wav	tɕe tɤpɤtso nɯnɯ ɯ-tɯ-ɕqraʁ pjɤ-sɤre ʑo tɕe, 
hist140521_huangdi_de_xinzhuang_S013.wav	tɕendɤre tɯrme nɯra, ɯ-xso nɯra kɯ huangdi nɯ ta-fɕɤt-nɯ tɕe,
hist140515_congming_de_wusui_xiaohai_S010.wav	tɯrme kɯβde nɯ kɯ iɕqha, nɯ-tɤ-fkɯm ɯ-ŋgɯ tɕe iɕqha χsɤr tʂaŋka nɯnɯ stoŋtsu ci kɤ-rku nɯnɯ, tɤfkɯm nɯnɯ,
hist-23-pGAYaR_S056.wav	tɕe ɯʑo li mpɕɤr, ɯ-tɯ-ɤkhra nɯ
hist-28-CAmWGdW_S061.wav	tɕendɤre ɯthɤcu nɯ, ɕɤmɯɣdɯ talɤtnɯ tɕe
hist-31-khAjmu_S021.wav	ɕoŋlo nɯ tɕe tɤ-mu kɯ-fse,
hist140504_baixue_gongzhu_S063.wav	tɯrme kɯ-mbɯ-mbɤr ʑo pjɤ-ŋu-nɯ, kɯɕnɯz pjɤ-tu-nɯ tɕe 
hist-08-khWjNga_S042.wav	ʑro tu-kɯ-ti ŋu tɕe
hist-23-mbrAZWm_S006.wav	kɯki ɯ-mdoʁ ʑo asɯ-ndo.
hist140513_shenqi_de_feitan_S129.wav	nɯra to-nɯ-sɤfsu-nɯ,
hist140428_yonggan_de_xiaocaifeng_S085.wav	"tɕendɤre nɤkinɯ, kɯmaʁ, nɤkinɯ,  si ɣɯ ɯ-jwaʁ low, ɯ-rtaʁ low aʑo tu-ndam-a ŋu"" to-ti."
hist-12-ndZiNgri_S126.wav	tɕeri tɤ-pɤtso pɯ-kɯ-ŋu tɕe,
hist140510_sanpian_yumao_S059.wav	tɕe nɯ kɤ-sɯ-ndo ndʑi-sɯm mɯ-pjɤ-ɕe tɕe tɕendɤre, 
hist140515_congming_de_wusui_xiaohai_S043.wav	tɕendɤre, nɤkinɯ,
hist140428_yonggan_de_xiaocaifeng_S103.wav	"""ajo, nɤʑo rcanɯ, nɤ-xɕɤt ɯ-tɯ-xtɕi nɯ ma, "
hist-03-zhenzhuquan2_S064.wav	tɕe ci ci tɕe nɤki, iɕqha,
hist-14-tasa_S089.wav	tasɤɣʑa nɯ tɕe tɕe mboʁ ɯ-spa kɯ-fse,
hist-12-ndZiNgri_S118.wav	tɕe nɯnɯ kɤ-ndza wuma ʑo mɯm.
hist-25-akWzgumba_S080.wav	nɯnɯ qaɕɣi ŋu.
hist-30-Com_S223.wav	ɲɯ-khɯ, ɲɯ́-wɣ-pɕiz ra ɲɯ-khɯ 
hist-31-cha_S060.wav	(mbrɤsɤm ɯ-ŋgɯ nɯ tɕu tú-wɣ-wum tɕe tú-wɣ-rmbɯ tɕe nɯnɯ li tɯthɯ tɤɕi ɯ-sɤ-sqa pɯ-kɯ-ŋu nɯtɕu tú-wɣ-rku)
hist140501_jingli_tshering_skyid_S126.wav	tɕe erlinglingsi nian ɯ-rʑaʁ a-me tɤ-tu ŋu.
hist140430_jin_e_S129.wav	mushi ɲɤ-k-ɤtɯɣ-nɯ tɕu tɕe, 
hist140521_huangdi_de_xinzhuang_S144.wav	ma tɯ-ŋga ɯ-ɕpɯz nɯra, nɤki, rɟɤlpu ɯ-ʁɤri nɯtɕu
hist-25-rtChWRjW_S031.wav	ɯ-kho tu-nɯ-βze qhe rdɤstaʁ rŋgɯ kɯ-fse ɣɯ ɯ-pa ri tu-ɲɟoʁ ɲɯ-ŋu.
hist-31-khAjmu_S009.wav	tɯ-tɤtʂu nɯ nɯ tɯ-sɤz-nɯmbjɯm nɯnɯ smi chɯ-kɤ-βlɯ nɯ pɯ-ŋu.
hist-27-tWCGArgu_S027.wav	kɯrcɤ-pɤrme thɯ-kɯ-ɤzɣɯt rɯtɕi
hist-29-mWBZi_S149.wav	ɯ-rkɯ ra ɲɯ-qanɯ tɕe, tɕe ɲɯ-saχsɤl, tɕe nɯ slɤzɯn ŋu.
hist-14-tasa_S084.wav	ɯ-mat nɯ ɯ-sna tu.
hist-23-mbrAZWm_S059.wav	tɕeri ɲɯ́-wɣ-phɯt qhe li andɯndo.
hist140516_huli_de_baofu_S065.wav	tɕendɤre, nɯra to-ti.
hist140507_jinniao_S050.wav	tɕendɤre nɯnɯ tɤru ɯ-tɕɯ stu kɯ-xtɕi nɯ kɯ tɯdi to-lɤt tɕendɤre,
hist140505_liuhaohan_zoubian_tianxia_S230.wav	"tɕendɤre nɤkinɯ, rɟɤlpu nɯ kɯ ""jɤɣ"" to-ti ma "
hist140518_huifei_de_muma_S046.wav	nɯra ɯ-ʁɤri zɯ jo-ɣi-nɯ.
hist140522_Kamnyu_tshupa_S016.wav	_taʁrdo nɯ kɯɕɯŋgɯ pɯ-kɯ-rɤsta ʑo nɯ tɯ-tɯpɯ ma pjɤ-me.
hist140522_Kamnyu_tWji_S063.wav	nɯra tu-ndza-nɯ ɲɯ-ŋu.
hist140430_yufu_he_tade_qizi_S068.wav	tɕendɤre nɤkinɯ, rgɤtpu nɯ ɯ-ɕki jo-ɣi tɕe,
hist-26-mYaRmtsaR_S116.wav	ma nɯnɯ tɕe, ɴɢoɕna ɣɯ nɯ stoŋtsu,
hist140430_jin_e_S237.wav	"""nɤʑo, nɤki, cha nɯ thamtɕɤt ʑo nɯ-kɯ-jtshi-a,"
hist-23-mbrAZWm_S193.wav	ri ɯʑo kɯ-jɯ-jaʁ ʑo mphɤβmphɤβ ɲɯ-ŋu tɕe, (ideoph)
hist140522_RdWrJAt_S117.wav	mɯŋi , mɯŋi  nɯnɯ, liangge, maʁ kɯ, sange xiaodui
hist-25-rtChWRjW_S046.wav	qambalɯla kɯ-dɯ-dɤn ʑo ɲɯ-βze qhe,
hist-06-BGa_S055.wav	nɤki rdɤstaʁ kɤrtɯm (βɣɤtu) ɲɯβzunɯ tɕe,
hist140514_huishuohua_de_niao_S190.wav	maka tɤ-zgra nɯra maka mɯ-pjɤ-mtshɤm.
hist140508_benling_gaoqiang_de_si_xiongdi_S199.wav	ko-mtsaʁ tɕe tɕendɤre iɕqha nɯ, iɕqha,
hist-12-kAtsxWB_S012.wav	tɕe nɯtɕu pjɯ́-wɣ-ta tɕe tɕendɤre,
hist140428_mu_e_guniang_S110.wav	"""wo a-mbro, nɤʑo kutɕu to-tɯ́-wɣ-ɕɯɴqoʁ tɕe"" to-ti ɲɯ-ŋu."
hist140513_mutong_de_disheng_S146.wav	tɕendɤre kɯ-maqhu rcanɯ, tɕendɤre tɯrɟaʁ ɯ-xɕɤt kɯ, nɯnɯ nɤkinɯ,
hist-31-cha_S167.wav	tɕe tɯŋgu ɯ-ŋgɯ nɯtɕu li tɯ-ci kú-wɣ-lɤt
hist140508_shier_ge_tiaowu_de_gongzhu_S076.wav	ɯʑo kɯ masɤrɯrju iɕqha cha nɯ pjɤ-lwoʁ.
hist-30-Com_S206.wav	tɕe nɯ rŋɯl ɯ-taʁ tu-mar-nɯ tɕe nɯnɯ 
hist140510_sanpian_yumao_S073.wav	"tɕe nɯ ʑɯmkhɤm ɯ-ku rcanɯ, kɯki kɯ-fse kɤ-βzu kɯ-cha ɯ-kɯ-fɕi maka me"" to-ti."
hist-16-CWrNGo_S205.wav	ɯ-ru tsa fse ri,
hist140519_mai_huochai_de_xiaonvhai_S059.wav	raʁ, nɤki, kɯ-qarŋe kɯ, nɤki, ɯ-phoŋbu nɯ-kɤ-z-ɣɤmpja pjɤ-fse tɕe, 
hist-28-qapar_S106.wav	ɲɯ-χtsɤβ-nɯ ɲɯ-mar-nɯ qhe,
hist-14-sWNgWJu_S119.wav	kɯ-ɤrqhɯrqhi ju-kɯ-ru tɕe ɯ-mdoʁ tɯ-tɯphu ma kɯ-me fse,
hist140516_zaixiang_he_candou_S001.wav	rɟɤβlun chondɤre stoʁ kɤ-ti
hist-23-RmWrcWftsa_S055.wav	tɕe kɯmaʁ ra nɯ kɯ-fse me ri,
hist140428_yonggan_de_xiaocaifeng_S257.wav	tɕendɤre iɕqha nɯ, tɤpɤtso ɯ-xɕɤt tɯ-tu ʑo to-ɣɤɕqali tɕe,
hist-07-Cku_S036.wav	tɕeri kú-wɣ-rtoʁ tɕe mɤ-kɯ-tso ra ku-rtoʁ-nɯ tɕe 
hist-28-smAnmi_S377.wav	tɕendɤre kɯ-sɤndza tu-oɣɯɣu.
hist140429_qingwa_wangzi_S185.wav	nɯ ɯ-qhu qhe tɕe to-rɯstɯmɯ-ndʑi.
hist-31-deluge_S105.wav	"tɕendɤre /kɯm/ iɕqha nɯ, kɯ-mɯɕtɯɕtaʁ ʑo tu ri, ""wutɕhɯtɕhɯ"" ma-tɤ-tɯ-ti ra"" to-ti."
hist-12-kAtsxWB_S006.wav	nɯnɯ tɯ-ŋga pɯ-kɯ-ɴɢraʁ kɤ-kɯ-spoʁ ɣɯ ɯ-stu nɯnɯ
hist140430_jin_e_S011.wav	/ndʑi-tɕɯ/ nɯ-tɕɯ kɯ-xtɕi nɯ kɯ nɯra maka  maka mɯ-pjɤ-naʁdɯɣ, mɯ-pjɤ-sɤmbrɯ.
hist140511_alading_yu_shendeng_S004.wav	tɕe nɯra kɯ-fse ɲɯ-ŋu tɕe tɕendɤre, iɕqha nɯ, nɯnɯtɕu zɯ, li sŋaspa ci pjɤ-tu.
hist-11-paRzwamWntoR_S135.wav	tɕe nɯnɯ ɣɯ ɯ-mnɯ kɯ-fse tu-kɯ-ɣi nɯnɯ 
hist-26-mYaRmtsaR_S006.wav	ɯ-phɯxpa kɯ-fse ra tu.
hist-28-qAjdo_S074.wav	a-pɯwɯ kɤ-ɕɯ-ŋke mɯ́j-khɯ qhe, (340)
hist-07-deluge_S109.wav	tɕendɤre tɯpɣaʁ lo-tɕɤt-ndʑi
hist-06-BGa_S015.wav	tɕe nɯnɯ pjɯ́-wɣ-phɯt tɕe nɯnɯ ɯ-χcɤl nɯ chɯ́-wɣ-sɯxso tɕe  
hist140513_shenqi_de_feitan_S202.wav	aʑo a-rkɯ zɯ jɤ-sɯɣe-t-a tɕe,
hist140426_nWNa_ra_nWrmi_S022.wav	qhe nɯra ʁjaŋphɯl kɯ-rmi tu,
hist-05-qaZo_S128.wav	tshɤt qaʑo nɯnɯ tɕe laʁnɯxpa ma chɯmdɯ-nɯ mɯ́jŋgrɤl
hist140510_sanpian_sheye_S101.wav	ɯ-mɲaʁ χchoʁe pjɤ-ɲɟoʁ, ɯ-mtɕhi ɯ-taʁ ra pjɤ-ɲɟoʁ.
hist-09-mi_S046.wav	tɕe nɯ taʁrɤt kɯfse kɯɕɯŋgɯ pjɯβzunɯ pjɤŋgrɤl ma nɯ ma sna me.
hist-28-kWpAz_S200.wav	iʑora ji-tɯci ɯ-ŋgɯ nɯra qajɯ, qaɟy ɯ-pɕoʁ tu, ma nɯ ma me 
hist-21-lWlu_S073.wav	tɕe ɲɯ-mtsɯr tɕe 
hist140522_Kamnyu_tshupa_S011.wav	cɤmi taʁ ra, cɤmi pa ra kɤ-ti tu-nɯ.
hist140516_yiguan_ganlan_S065.wav	"tɕe wuma ʑo ɯ-mbrɯ to-ŋgɯ ma nɯ ""a-βzaŋsa nɯ kɯ nɯra to-stu"""
hist140505_sWjno_S027.wav	aja, pɣɤtɕɯ-xɕaj /pɣɤjmŋ/ pɣɤjmɤt xsɤrɯ cɤmixɕaj ɯnɯnɯ nɯra tɕe xɕaj tu-kɯ-ti ŋu ma tɤ-jwaʁ tu-kɯ-ti maʁ.
hist140521_jianding_de_xibing_S035.wav	ɯ-rti li kɯ-mpɕɯ-mpɕɤr ʑo pjɤ-ŋu.
hist-25-xCelwi_S044.wav	tɕe nɯnɯ kɯ-fse nɯ ɲɯ-nɤmbju ʑo qhe,
hist-26-kWrNukWGndZWr_S083.wav	nɯnɯ wuma ʑo nɯ-ɣɯtshɤdɯɣ tɕe tu ma, nɯ mɤɕtʂa me.
hist-26-ndzWrnaR_S017.wav	ku-mtsɯɣ tɕe nɯnɯ, ku-kɯ-mtsɯɣ tɕe, wuma ʑo aɣɯtɯɣ, mŋɤm tɕe,
hist140521_huangdi_de_xinzhuang_S018.wav	tɕendɤre tɯ-sŋi tɕe, iɕqha nɯ, kukutɕu rɟɤlkhɤβ nɯtɕu, maka, kɯ-rɯkhramba ʁnɯz jo-ɣi-ndʑi. 
hist-20-ldWGi_S007.wav	ɯ-ndʐi kɤ-mto pɯ-rɲo-t-a.
hist140517_huli_he_lang_de_gushi_S008.wav	tɕendɤre kɯ-ɤrqhɯrqhi ʑo ju-ru tɕe iɕqha, rgɤtpu chondɤre iɕqha, 
hist140427_xuanshi_zhi_shen_S038.wav	tɕendɤre, nɤkinɯ, jo-nɯ-ɬoʁ tɕe ɯ-mthoŋ nɯra pjɤ-nɯ-ɬoʁ tɕe,
hist140519_chou_xiaoya_S183.wav	tɕendɤre ɯ-sɯm ɯ-pa ɯ-ŋgɯ ʑo tɕe tɕendɤre, ɲɤ-rga, 
hist-28-kWpAz_S083.wav	nɯnɯ kɯrnɯ ŋu tɕe, ɯʑo ɣɯrni.
hist-27-tApGi_S038.wav	tɕe nɯnɯ pjɯ-mbɯt cha mɤ-cha mɤxsi, ma nɯ tu-stu-nɯ ŋu.
hist-X1-qachGa_S090.wav	"ndʐimɯmajin ('dre ma yin) kɯ, nɤki, kɤ-qur kɯ-ra ŋu, kɯki kɤ-sɤntɤm kɯ-ra ŋu"" tɤ-ti tɕe tɕe"
hist-25-akWzgumba_S127.wav	thɤlwa kɯ-fse kɯ-dɤn maŋe ri,
hist140516_WrJANgo_S002.wav	tɯŋgo nɯnɯ kɯmaʁ /kɯmŋɤm/ tɤ-kɯ-mŋɤm nɯ ɣɯ ɯ-rca nɯtɕu li nɯnɯ mɤpɕoʁ chonɤ tɕe li tu-kɯ-mŋɤm ci ɣɤʑu tɕe, nɯ ɯrɟɤŋgo tu-kɯ-ti ŋu.
hist-11-paRzwamWntoR_S124.wav	tɕeri tɤru ɣɯ ɯ-jwaʁ kɯ ɲɯ-jndʐɤz 
hist-12-BzaNsa_S038.wav	tɕe stu kɯ-dɤn nɯnɯ tɯ-xpa tɯ-ɣjɤn ɕaŋtaʁ mɯ-kɯ-ɤmɯtɯɣ pɯ-me
hist-06-BGa_S081.wav	tɕɤtu βɣa khɤrka ri  tu-ɕɯɴqoʁ-nɯ
hist-27-kikakCi_S188.wav	ma ɯʑo nɯ ɯ-qataʁrɯ ɣɤʑu 
hist140522_Kamnyu_tWji2_S123.wav	kɯ-ji kɯ-rɲɟi ci tu tɕe nɯnɯ ɕkɤwu rmi.
hist140430_jin_e_S140.wav	nɯ tɤpɤtso, tɕheme ra nɯ-qhu ju-rɟɯɣ tɕe maka mɯ-ɲɯ-βde pjɤ-ŋu tɕe,
hist140428_mu_e_guniang_S067.wav	tɕeri nɯnɯ pɯ-azgɯr tɕe, ɯ-mthɤɣ pa-chɤβ pɯ-azgɯr ʑo
hist140511_alading_yu_shendeng_S094.wav	"nɯ ɯ-ŋgɯ rcanɯ, maka tɯrɟɯ laχtɕha saχaʁ ʑo"" to-ti."
hist140425_jiashu_he_tianshu_S045.wav	"tɕe nɯra nɤʑo nɤ-mɤ-kɤ-nɤmthu ɣɯ nɯnɯra, nɤki nɯ tɕu ju-ɕe-a ɲɯ-mna"" to-ti ɲɯ-ŋu."
hist-29-tAmtshAzkAkWndo_S011.wav	tɕendɤre, nɤkinɯ, ɯ-zbɤβ ɲɯ-ɬoʁ ɲɯ-ŋu.
hist-X1-qachGa_S148.wav	tɕendɤre jo-nɯɕe-ndʑi tɕe, jo-nɯɕe-ndʑi tɕe, tɕendɤre nɤki ci nɤ,
hist-24-qro_S057.wav	ki tu-ste tɕe ki ta-stu tɕe taχpa khro mɤ-pe,
hist-28-smAnmi_S232.wav	tɕe nɯnɯra ɣɯ nɯ-rɟɤlpu pjɤ-ŋu.
hist-11-pWwW_S014.wav	kɤ-ɕɯŋke mɯ-tu-khɯ tɕe lu-nɯ-rŋgɯ ŋu ra tu-ti-nɯ pɯ-ŋgrɤl
