path	sentence
hist-17-ndZWnW_S105.wav	nɯnɯ li sɯjno ŋu.
hist140518_huifei_de_muma_S099.wav	tɕendɤre nɤkinɯ iɕqha nɯ, ɯ-me nɯnɯ, nɯ ɣɯ stu kɯ-xtɕi nɯ nɯ ɣɯ ɲɯ-kɤ-kho  /mɯtonɯ/ mɯ-to-nɤla qhe, 
hist-19-GzW_S004.wav	ɕa tɕi ɲɯ-ndze, qhe tɯjpu tɕi ɲɯ-ndze,
hist-20-xsar_S028.wav	qi ba shi jin jamar a-pɯ-zɣɯt tɕe,
hist140429_qingwa_wangzi_S079.wav	"qaɕpa nɯ kɯ ""tɤɕime, ku-kɯ-nɤjo-a!"" ntsɯ to-ti."
hist-17-ndZWnW_S039.wav	ma nɤki, sɯjno tɕe nɤki nɯ ɕti ma,
hist-22-tAmbrWm_S009.wav	tɕe nɯ ɯ-qhu mɤ-kɯ-nɤmbrɯm tu-ti-nɯ ɲɯ-ŋu ri,
hist-23-mbrAZWm_S090.wav	khɯtsa jamar kɯ-tu tu.
hist140510_sanpian_sheye_S080.wav	tɯ-mpɕar nɯnɯ iɕqha, ɯʑo pɯ-kɤ-ʁndzɤr nɯnɯ ɣɯ nɯnɯ iɕqha,
hist140519_mai_huochai_de_xiaonvhai_S150.wav	"tɕe nɯ ""a-wi"" to-ti tɕendɤre, tɤ-pɤtso nɯ kɯ, to-ti ʑo, to-ɣɤɕqali ʑo ri,"
hist-22-qAjdo_S045.wav	"""tɤ-mtsɯr kɯ mɯ́j-cha-a"" to-ti."
hist140513_qianshang_he_xiaotou_S021.wav	kha ju-tɯ-zɣɯt ʑo tɕe, 
hist-27-kikakCi_S060.wav	cɤmtsho ŋu maʁ nɯnɯ, iɕqha nɯ,
hist140513_mutong_de_disheng_S093.wav	"""nɯ-phoŋbu ra a-nɯ-ɤrlɯrla"" to-ti tɕe, "
hist-23-RmWrcWftsa_S041.wav	ma nɯnɯ qalekɯtshi ŋu tɕe, 
hist140520_ye_tiane_S341.wav	tɕendɤre, mɤʑɯ tɯ-rdoʁ tɕe tɕe chɯ-sthɯt pjɤ-ŋu ri, 
hist-18-NGolo_S127.wav	tɕendɤre, nɤki tu-sɯ-mtɕɯr 
hist-23-pGAYaR_S097.wav	ma ʁmɯrcɯ ɣɯ nɯ ki tsa ɲɯ-fse tɕe,
hist-11-mtshalu_S028.wav	nɯnɯ qusput tu-mbri ɕɯŋgɯ tɕe, smɤn ŋu tu-kɯ-ti ŋu
hist140513_shenqi_de_feitan_S216.wav	tɕe sɤtɕha ɯ-ku mɯ-ɲɤ-rɤʑi.
hist-26-qambalWla_S005.wav	kɯ-ɣɯrni rkɯn.
hist140427_laoying_mao_he_yezhu_S003.wav	lɯlu nɯ kɯ li, iɕqha nɯ, nɯnɯ si nɯ ɣɯ ɯ-taʁ nɯ tɕu kɯ-spoʁ ci /ɣɤʑu/ pjɤ-tu tɕe,
hist-27-tApGi_S070.wav	nɯ koʁmɯz tu-saχsɤl ɕti tɕe, nɯ wuma ʑo ɲɯ-mŋɤm.
hist140516_zaixiang_he_candou_S059.wav	tɯtsɣe ɯ-kɯ-βzu tɯrme nɯnɯ kɯ, iɕqha nɯ, kɯki iɕqha rɟɤβlun kɯ ɯʑo ɣɯ rŋɯl nɯ-kɤ-kho nɯnɯ kɯ tɯtsɣe to-sɯβzu tɕe, ʑaʑa ʑo chɤ-mɤɕi,
hist-22-qAjdo_S008.wav	tɕe qajdo nɯ, nɤkinɯ, li tu-mbri tɕe mɤ-naχtɕɯɣ ma 
hist140428_mu_e_guniang_S168.wav	"nɤki, tɕhɯpɣa ɯ-kɯ-lɤɣ mɤ-ɕe-a"" to-ti ɲɯ-ŋu."
hist140512_fushang_he_yaomo1_S168.wav	"tɕendɤre, tɕe kɯki nɤ-χpi pjɯ-fɕat-a ki ɯ-ɲɯ́-sɤmtshɤr, ɯ-ɲɯ́-pe?"" to-ti."
hist140505_stonka_mWntoR_S010.wav	tɕe nɯ li ci stonka mɯntoʁ tu.
hist140510_fengwang_S023.wav	qro ɯ-kho ci pjɤ-mto-ndʑi tɕe tɕendɤre tɤ-pi nɯni wuma ɲɤ-rga-ndʑi tɕe,
hist-22-pGAkhW_S006.wav	ma nɯnɯ pɣɤkhɯ ŋu tɕe,
hist140515_congming_de_wusui_xiaohai_S076.wav	tɕe tɤpɤtso nɯ kɯ rcanɯ wuma ʑo, nɤki, ɲɯ-ʑɣɤmgɯ ʑo tɕe to-ti tɕe, 
hist-28-qapar_S077.wav	iʑora kɯrɯ ra tɕe rɤjla ɯ-ndo ra ku-nɯ-lɤt-i tɕe,
hist140505_sWjno_S021.wav	zɣɤmbu ɯ-spa ɲɯ-nɯ-phɯt-nɯ ŋgrɤl.
hist-23-scuz_S137.wav	tɕe nɯ tɕhɯβja ŋu, nɯ tɕhɯpɣa.
hist140512_fushang_he_yaomo1_S124.wav	"tɕe nɯnɯ pɯ-tɯ-mtshɤm tɕe koŋla ʑo, ʑgrɯɣ ʑo tɯ-rga ɕti"" to-ti."
hist140508_benling_gaoqiang_de_si_xiongdi_S065.wav	tɕe nɯnɯ ɯ-sloχpɯn to-sɯβzu.
hist140519_wandou_gongzhu_S006.wav	tɕe tɕendɤre, nɤki, rɟɤlpu ɯ-tɕɯ nɯ rcanɯ, /rɟ/, ʑɯmkhɤm ɯ-ku ʑo chɤ-ɕar ri, 
hist-15-babW_S163.wav	ma nɯnɯ qandzɤpɤr ŋu.
hist140516_huli_de_baofu_S022.wav	nɤki, nɯ-sɤ-ndo ɯ-spa pjɤ-ŋu.
hist140519_mai_huochai_de_xiaonvhai_S024.wav	kɯki tɯ-sŋi kɯki,  (calque)
hist140516_huli_de_baofu_S134.wav	kɯki lɤzŋɤn spjaŋkɯ khi. 
hist140520_ye_tiane_S063.wav	ɯ-βri nɯra kɯ-ɲɯ-ɲaʁ ʑo tɕe, tɤrpat ɯ-mdoʁ ʑo kɯ-fse  ɲɤ-sɯndo,
hist140518_mao_he_laoshu_S018.wav	tɕe nɯ jamar tɕe tɕendɤre, kɯ-spoʁ ɯ-ŋgɯ, 
hist-12-ndZiNgri_S181.wav	tɕe nɯnɯ ɯ-mɯntoʁ nɯnɯ ɲɯ-ŋu tɕe,
hist-14-tApitaRi_S073.wav	tɕe a-ftsa ɣɯ ɯ-χti nɯ pe 
20140429090403_S032.wav	kɯki kɯra ɯ-ɕnat ŋu.
hist-08-tWrgi_S005.wav	tɕe nɯ kɯ-jpɯ-jpum ʑo ɲɯ-βze tɕe,
hist140501_jingli_tshering_skyid_S070.wav	"tɕe a-pi kɯ ndɤre ""smɤnba ɲɯ-pe ɕti ma,"
hist-17-xCAj_S106.wav	tɤpɤtso ɯ-kɯmŋɤm, tɤpɤtso ra,
hist140515_facai_meng_S014.wav	tɕendɤre ɯ-fso tɯmtɕi ʑo qhe tɕendɤre ɯ-rʑaβ ɯ-rɟit nɯra ɲɤ-βde qhendɤre, nɤki,
hist-14-tApitaRi_S347.wav	tɕe nɯnɯra kɤndʑɯʁi ra nɯra ŋu-j tɕe, nɤ-tɯ-fɕɤt ŋu
hist140427_qamtsWrmdzu_S019.wav	tɕe qamtsɯrmdzu nɯnɯ, nɤkinɯ, ɯ-mdoʁ ra, ɯ-jwaʁ me, ɯ-mdzu me, kɯ-pɣi ci ŋu.
hist140430_lang_he_qizhi_xiaoshanyang_S049.wav	iʑo ji-mu ɣɯ ɯ-ndzrɯ kɯki kɯ-fse kɯ-ɲaʁ maʁ,
hist-X1slobdpon_S175.wav	"""mtshoʁlaŋ ni a-khɤkɯm, nɤki, a-khɯna ʑo a-pɯ-fse-ndʑi ra"" to-ti ɲɯ-ŋu tɕe "
hist-14-tApitaRi_S098.wav	tɕe tham alo kha ɯkɯnɯndo aftsa nɯ nɯnɯ ŋu ma 
hist-19-qachGamWntoR_S113.wav	nɯ ɣɯ ɯ-rme kɯ-fse ci tu tɕe,
hist-25-RmArYWG_S020.wav	ʁmɤrɲɯɣ ftɕar tɕe, iʑora qi bayuefen tu ma, nɤkinɯ,
hist140512_fushang_he_yaomo1_S025.wav	ɯ-taʁ rtɤβ pjɤ-ŋu tɕe tɕendɤre, 
hist140504_baixue_gongzhu_S203.wav	tɕe tɤpɤtso kɯ-ndɯ-ndɯβ nɯra jɤ-azɣɯt-nɯ tɕe tɕendɤre,
hist-30-CnAto_S007.wav	nɯ tɕhi nɯ ŋu mɤxsi ma nɯnɯ chɯ-ndɯl-nɯ
hist140513_shenqi_de_feitan_S156.wav	nɯnɯ ɕu, tɯdi jɤ-lɤt-nɯ tɕe,
hist-31-deluge_S084.wav	"qhe ""nɤ-rca tu-kɯ-tsɯm-a ra"" to-ti."
hist140521_jianding_de_xibing_S124.wav	iɕqha ʑmbrɯ nɯnɯ tɯ-ci kɯ-wxti /ɣɯ jo/ jó-wɣ-sɤzɣɯt.
hist-14-sWNgWJu_S035.wav	tɕe nɯnɯ sɯŋgɯɟu ŋu.
hist-03-zhenzhuquan1_S021.wav	kɯki zhenzhuquan kɯki ɯ-mdoʁ nɯnɯ, nɤki, kɯ-ɤrŋɯrŋi ʑo, kɯ-ɤrɯldʑaŋkɯ ʑo kɯ-fse ɣɯ tɯ-ci ɲɯ-ŋu.
hist-24-ZmbrWpGa_S044.wav	kɯmaʁ ra kɯ-fse mɯ́j-rɲɟi.
hist140511_alading_yu_shendeng_S088.wav	tɕendɤre iɕqha nɯ, matɕi sŋaspa nɯ kɯ ɯ-ftɕɤfkɤt to-tɕɤt.
hist-02-deluge2012_S028.wav	tu-ɕe nɤ tu-ɕe pjɤ-ɕti qhe
hist140522_Kamnyu_tshupa_S116.wav	tɕe nɯnɯ prɤɕta ŋu, nɯ ɯ-thɤcu tɕe prɤku.
hist140517_buai_shuohua_de_gongzhu_S026.wav	nɯnɯ tɯrme nɯ rcanɯ, ɯ-tɯ-fse pjɤ-saχaʁ ʑo rcanɯ, 
hist140510_sanpian_sheye_S051.wav	tɯrsa ɯ-rkɯ nɯtɕu ku-omdzɯ tɕe, 
hist140510_fengwang_S022.wav	ɯ-thoʁ nɯ tɕe, iɕqha nɯ, qro ɣɯ ɯ-kho ci /pjɤ-mto-ndʑi/ pjɤ-mto-nɯ.
hist140506_shizi_he_huichang_huichang_de_bailingniao_S105.wav	tɕe nɯnɯ nɤmkha ɲɯ-nɯqambɯmbjom-a tɕe 
hist-14-tApitaRi_S255.wav	tɕe nɯ ɯ-pa ri a-ʁi nɤmkhathɤr kɤ-ti ci tu,
hist-29-tAmtshAzkAkWndo_S073.wav	tɕe nɯ pjɯ-nɯzarzɯr tu-ti-nɯ ŋgrɤl tɕe,
hist140430_jin_e_S205.wav	nɯnɯ rgɤtpu nɯ nɯnɯ ɯ-sta nɯtɕu ʑo pjɤ-rɤʑi tɕe,
hist140428_mu_e_guniang_S061.wav	tɕe mbro ɯ-taʁ to-ɕe tɕe li jo-ɕe-nɯ.
hist140506_woju_guniang_S100.wav	"""woju, nɤ-kɤrme pɯ-sɯɣe wo, pɯ-ɕɯɴqoʁ tɕe, /nɤki/"" to-ti"
hist140514_huishuohua_de_niao_S021.wav	nɯnɯ ndʑi-ftsa nɯnɯ, nɤki, ɟu taɴɢoʁ ɯ-ŋgɯ to-rku-ndʑi qhendɤre,
hist140510_fengwang_S043.wav	nɯnɯ si ɯ-ku zɯ, nɤkinɯ, iɕqha ɣʑo ɣɯ ɯ-loʁ pjɤ-tu.
hist-12-Zmbroko_S034.wav	tɕe nɯnɯ ʑmbroko ŋu.
hist-12-kAtsxWB_S084.wav	tɕheme ɣɯ nɯnɯ tɕe, kundi ɲɯ-ɕe tɕe nɯ kóʁmɯz pa pjɯ-ɕe ŋu.
hist140516_guowang_halifa_he_mutong_S091.wav	tɕendɤre nɯɕɯmɯma ʑo kumpɣɤtɕɯ nɯ ɲɤ-lɤt.
hist140506_shizi_he_huichang_huichang_de_bailingniao_S040.wav	ɯ-taʁ to-rɤβʁa tɕe,
hist140501_jingli_tshering_skyid_S017.wav	tɕe nongcun ʑo ku-rɤʑi-a pɯ-ŋu 
hist140518_jinyin_chengbao_S025.wav	nɯnɯ tɕe, nɯ-tɯfɕɤt pjɤ-βzu tɕe, 
hist-25-rtChWRjW_S064.wav	tɕe nɯnɯ kɯ staχpɯ ɯ-jwaʁ tu-ndze ŋu ɕi, 
hist140513_shenqi_de_feitan_S058.wav	"kɯki a-tɤ-nɯ-χti jɤɣ"" to-ti."
hist140521_jianding_de_xibing_S063.wav	iɕqha ɕnɤto ɯ-fkɯm ɣɯ ɯ-fkaβ to-ɲɟɯ.
hist-27-spjaNkW_S128.wav	tɕe nɯ ɯ-tʂɤm nɯnɯ ra kɯnɤ, nɯnɯ, nɯ-χpɯm cho ŋotɕu kɯ-mŋɤm ra ɲɯ-mar-nɯ 
hist140501_jingli_tshering_skyid_S011.wav	tɕe sɤ-xtɕɯ-xtɕi pɯ-xtɕi-a tɕe tɕe,
hist140510_fengwang_S017.wav	tɕendɤre ɯ-pi ni, tu-kɯ-wxti ni kɯ tu-ŋke-ndʑi ɯ-khɯkha 
hist140516_guowang_halifa_he_mutong_S027.wav	halifa nɯ wuma ʑo to-sɤmbrɯ tɕe nɯnɯ ɯ-ʁjoʁ ra nɯ-ɕki kɯki tɤ-pɤtso kɯki kɤ-ndo-nɯ tɕe nɤki,
hist-23-scuz_S092.wav	nɯ ʁɟa ʑo ɣɯ-tu-ndze ɲɯ-ŋu.
hist-22-BlamajmAG_S014.wav	tɕe ki ʑo ɲɯ-fse tu-ɬoʁ tɕe boŋboŋ ʑo ɲɯ-pa (ideoph)
hist140507_tangguowu_S015.wav	"tɕe ""kɯsthɯci ʑo maka ɲɯ-ŋgɯ-j ɕti tɕe,"
hist140515_jiesu_de_laoren_S109.wav	tɕendɤre wuma ʑo pjɤ-sɤscit ri, kɯ-ɕe ɯ-skɤt maka mɯ-pjɤ-βzu. 
hist-26-mYaRmtsaR_S148.wav	tɕe aʑo a-kɤ-sɯz kɯβde-tɯphu ɣɤʑu ma porɤt nɯ ɲɯ-ŋu,
hist-07-deluge_S044.wav	tɕendɤre nɯ ɯfsomɯr qhendɤre, tɯlɤt nɯ ɯtaʁ kondzoʁ qhe
hist140427_yuanhou_he_lianggeren_S021.wav	"nɯ-ftɕɤfkɤt to-tɕɤt tɕe, ""iɕqha tɯrme ʁnɯz nɯ jɤ-ɣɯt-nɯ, a-ʁɤri lɤ-ɣɯt-nɯ ra"" to-ti ɲɯ-ŋu."
hist140514_beifeng_yu_taiyang2_S035.wav	daltsɯtsa ɲɯ-kɤ-nɯkhɤda kɯ-fse, tu-kɤ-ti tɕe, 
hist-14-sWNgWJu_S033.wav	sɯŋgɯ kɯnɤ ɴqiaβ ri tɕe, si kɯ-wxti ra ɣɯ nɯ-rchɤβ ri, tu-ɬoʁ
hist-04-qala1_S032.wav	qala kɯ tɤmthɯm mɤ-ndze tɕe, xɕaj ʁɟa ʑo tu-ndze ɕti 
hist140508_benling_gaoqiang_de_si_xiongdi_S097.wav	taqaβ tɯ-ldʑa ɲɤ́-wɣ-mbi tɕe, mɯntoʁ sɤ-tʂɯβ taqaβ pjɤ-ŋu tɕe,
hist140425_shizi_huli_he_lu_S097.wav	sɯŋgɯ kɯ, nɤʑo nɤ-rna pa-rɤɕi nɯnɯ tɕe 
hist140513_abide_he_mogui_S093.wav	"ɯ-xso tɯrme ɲɯ-tɯ-ɕti tɕe, tɕhindʐa kɯ-ɕɯnŋo-a ra?"" to-ti ɲɯ-ŋu."
hist-30-kWrAfcAr_S063.wav	(nɤʑo kɯki kɤɣɯjre, aʑo kɯki kɤɣɯjruta)
hist-19-mi2_S017.wav	ɯ-jndɯz kɯ-fse nɯ ɣɤʑu, ɯ-srɯn kɯ-fse nɯ ɣɤʑu,
hist140518_xuezhe_he_huangshulang_S014.wav	tɕendɤre maka pjɯ-ɣɤrʑɯɣlɯɣ ʑo tɕendɤre 
hist-X1slobdpon_S047.wav	"tɕe tɕheme nɯ kɯ ""ɣa"" to-ti ɲɯ-ŋu tɕe,"
hist-17-xCAj_S117.wav	ftɕar tɕe, paʁ ra rɯŋgu ntsɯ ɕ-tu-no-nɯ ɲɯ-ŋu.
hist140428_kAtsxWB_S007.wav	tɕe nɯnɯ tɕe kɯ-mpɕɤr kɤ-nɯ-sɯ-pa.
hist-05-qaZo_S157.wav	tɯrme ra kɯ-ŋgɯ kɯ-fse tu-sɤpa-nɯ ɕti ma nɯ
hist-27-qartshAz_S128.wav	tɕe nɯ rirɤβ stu kɯ-wxti nɯtɕu ʑo
hist-31-deluge_S071.wav	"""nɤ-rca tu-kɯ-tsɯm-a ra"" to-ti ri, "
hist140515_facai_meng_S016.wav	tɕendɤre tʂu ra wuma ʑo kɤ-ŋke pjɤ-ɴqa matɕi 
hist140505_xiaohaitu_S086.wav	nɯtɕu tɕendɤre pjɤ-mto.
hist140430_yufu_he_tade_qizi_S103.wav	tɕendɤre ɯ-ɕki to-ti tɕe,
hist140507_tangguowu_S157.wav	ndʑi-mu nɯnɯ to-ngo tɕe, iɕqha tɤ-ɬaʁ nɯ to-ngo tɕe ɲɤ-si
hist140426_xiaohaizi_he_hua_de_shizi_S020.wav	ɯ-tɕɯ nɯnɯ kɤ-ɣɤrʁaʁ pjɤ-rga tɕe,
hist140515_huli_he_yuelv_S087.wav	nɯnɯ pɯwɯ nɯ pjɤ-si ʁo alala ri, tɕe iɕqha, nɤkinɯ, qachɣa kɯ-fkrɯz nɯ kɯ to-ndza tɕe, nɯ kɯnɤ ɯ-sroʁ to-tɕɤt ɲɯ-ŋu.
hist-13-tCamu_S019.wav	ɯ-mɯntoʁ ɯ-taʁ kɯnɤ ɯ-jwaʁ ɲɯ-βze ŋu ma
hist-07-tAtho_S022.wav	tɕe kupa ra kɯ tɕe (nɤkinɯ) ɯ-tshuxtoʁ kɯ-tu ma 
hist-27-qartshAz_S058.wav	nɯnɯ ɯ-ŋgɯ ndɤre
hist-04-cuiniao_S064.wav	"kɤ-ndo mɤ-tɯ-cha-nɯ"" to-ti."
hist-08-qaCti_S019.wav	ɯ-χcɤl ri ɯ-jndɯz kɯ-fse ci tu tɕe nɯnɯ
hist140513_mutong_de_disheng_S118.wav	tɕendɤre nɤki iɕqha kɯ-βʁa nɯ kɯ tɕe, ɯ-mbrɯ sɤ-ŋgɯ-ŋgɯ, 
hist140513_shenqi_de_feitan_S107.wav	"tɯ-jaʁ mɤ-ɣi thaŋ"" tɕe,"
hist-X1slobdpon_S259.wav	"kɤ-ndza kowa tú-wɣ-βzu ɕti tɕe ku-ta-sɤnbaʁ ŋu"" to-ti tɕe,"
hist-27-tWfCAl_S040.wav	a-pɯ-ɤcilej, ɯ-ɕtʂi ra a-pɯ-dɤn kɯ-fse tɕe,
hist-14-sWNgWJu_S015.wav	tɕe ɯ-mɯntoʁ kɯ-fse ra kɯ-tu maŋe.
hist-05-qaZo_S113.wav	ɯro nɯnɯ ra nɯ maʁ nɤ kɯɣɯrni, nɯ maʁ nɤ kɯɲaʁ ŋu tɕe,
hist-22-qomndroN_S045.wav	tɕe ɯ-ɕpɤβ pjɤ-mto nɤ, kɯki ɯ-ʁar ɯ-ndzom ɯ-spɯɣ kɯra ɲɤ-rɯqajɯ.
hist140521_huangdi_de_xinzhuang_S094.wav	tɕeri iɕqha /jɤkɤ/ jɤ-kɯ-ɤri nɯ kɯ, iɕqha nɯ, ɯ-raz ɣɯ ɯ-tɯ-ɤkhra cho ɯ-taʁ nɯra nɯ tu-fse ŋu, nɯ tu-raŋ ŋu tɕe,
hist-26-kWrNukWGndZWr_S085.wav	tɕe nɯnɯ ndɤ koŋla ʑo ɯ-ʁar ɣɤʑu.
hist-06-qaZmbri_S034.wav	ku-orʁɯrʁu kɯ-fse ŋu
hist140510_sanpian_sheye_S025.wav	tɕendɤre ri, tɤ-tɕɯ nɯra, ɯ-ɕki nɤkinɯ, ɯ-kɯ-thu pjɤ-me ma,
hist-30-tWjrukho_S003.wav	kɯ-rɤfcɤr kɯ tɯfcɤr nɯra ta-βzu tɕe,
hist-18-qromJoR_S011.wav	tɕe li aɣɯrtɯrtaʁ tɕe, ʁnɯ-rtsɤɣ jamar tu-mbro cha.
hist-X1slobdpon_S295.wav	kha jo-nɯ-sɤtɕitʂi-ndʑi tɕe
hist-05-qaZo_S091.wav	tɯji ɯŋgɯ chɯ́wɣlɤt tɕe tɤrɤku ɣɯ pɯnɯŋu 
hist140513_abide_he_mogui_S080.wav	tɕendɤre abide nɯ kɯ ɕlaʁ ʑo /kɤlɤt kɤ-ɤlɯlɤt  to-znɯna tɕe, /toti/ to-thu
hist140510_rkoNJAl_S052.wav	tɕe nɯnɯ tɤ-rpi ɲɯ́-wɣ-sɯβzu tɕe tɕe χtɕɤt ra pjɯ́-wɣ-sɯlɤt tɕe tɕe phɤn ɲɯ-ŋgrɤl tu-ti-nɯ ri, 
hist-30-macha_S030.wav	χtʂɯɣdʑa tu tɕe, tʂha ɲɯ-kɯ-nɯβzdɤr tu 
hist-08-khWjNga_S029.wav	ʑɯrɯʑɤri tu-wxti ŋu
hist140516_yiguan_ganlan_S064.wav	"tɕendɤre ɯ-sɯm tɕe nɯ kɯɕnɯ-xpa to-tsu ri, sɯmat nɯ kɯsthɯci kɯ-sɤr mɤ-ŋgrɤl"" ɲɤ-sɯso tɕe,"
hist-27-kharwut_S058.wav	ma nɯnɯ lɯɣmbrɯm ɲɯ-ŋu tɕe nɯnɯ,
hist-16-CWrNGo_S096.wav	tɯ-rdoʁ nɯ rca kɯ-wxtɯ-wxti ʑo.
hist140427_zei_he_lvguan_laoban_S010.wav	"nɤkinɯ, iɕqha nɯ ""kha ɯ-ŋgra ɲɯ-kham-a, "
hist-15-babW_S190.wav	lu-ɣɯrni sthɯci mɤ-pe ma tɕe 
hist140513_shenqi_de_feitan_S169.wav	tɕe kɤ-mto ɲɤ-me tɕe tɕendɤre,
hist140517_mogui_de_jing_S049.wav	ɯ-βlu to-tu tɕe bonuomu ɯ-ɕki to-ti tɕe, nɤkiɯ, nɤki,
hist140522_Kamnyu_tWji_S093.wav	_cindzɯku, wo nɯnɯ praʁwɯ ɯ-locu ri tɕe,
hist-11-mYAm_S053.wav	tɕe ftɕar tɕe tɕe ɯ-mɯntoʁ ɲɯ-lɤt ŋu laʁma,
hist-12-BzaNsa_S104.wav	tɕendɤre ɯ-ŋgɯ ri tʂɤm ra na-rku
hist-30-tChorzi_S029.wav	ɯnɯnɯ ɟu nɯ chɤmdɤru rmi
hist140427_wuya_he_huli_S006.wav	nɯ tɕu pjɤ-rɤʑi tɕe tɕendɤre,
hist-14-tApitaRi_S147.wav	tɕe nɯni ɣɯ ndʑi-me ci, ndʑi-tɕɯ ci tu
hist-25-tChWXpri_S020.wav	iʑo kɤmɲɯ ra kɯ tɕhɯχpri tu-ti-j ŋu.
hist-09-stoR_S020.wav	tɕe stoʁ nɯnɯ ŋu tɕe
hist-09-stoR_S052.wav	nɯ ɕɯŋgɯ tɕe tɕendɤre kɤ́rɯru ʑo pjɯ́wɣ-tɤβ 
hist-24-ZmbrWpGa_S018.wav	dɯdɯt sɤz kɯnɤ ɲɯ-xtɕi.
hist140519_wandou_gongzhu_S065.wav	kɯki ndɤre, koŋlaʑo tɤɕime ɲɯ-ŋu ma,
hist-31-deluge_S149.wav	nɯ kɯ-fse tɕe ɲɯ-ɲɤ-dɤn ʑo. 
hist-13-NAnWkWmtsWG_S035.wav	tɕe ŋgɯsɯ nɯnɯ, nɤkinɯ,
hist-26-qro-fourmi_S018.wav	qroɲaʁ nɯ sthi mɤ-sɤmtsɯɣ.
hist-28-smAnmi_S194.wav	tɕeri li maka srɯnmɯ cho srɯtphu nɯra jo-ɣi-nɯ tɕe tɕe nɯ,
hist-14-sWNgWJu_S090.wav	tɕe thɯci, tɯ-ɕa ɯ-mdoʁ tsa asɯ-ndo kɯ-fse.
hist-X1slobdpon_S146.wav	"""a rɟɤlpu fka ɕti tɕe, mɤ-kɤ-ɕe mɤ-khɯ."" to-ti ɲɯ-ŋu tɕe,"
hist140513_qianshang_he_xiaotou_S027.wav	ɯ-βlu ra tɤ-kɤ-tɕɤt tu-nɤme pjɤ-ŋu tɕe, 
hist-26-tWcipaR_S041.wav	zdɯmlaʁrɯʁrɯ ŋu tɕe,
hist140428_yonggan_de_xiaocaifeng_S021.wav	ɯʑo ɣɯ, nɤkinɯ, ɯ-mthɯxtɕɤr ɯ-taʁ nɯ tɕu, tɤscoz tɯ-tɤmphrɯm ko-rɤt tɕe ɯ-taʁ nɯ tɕu, nɤki,
hist-27-kikakCi_S203.wav	ɯ-ʁrɯ nɯ, ɕkɤrɯ ɣɯ ɯ-ʁrɯ nɯ, kɯ-xtɕɯ-xtɕi ci ma maŋe loβ.
hist140518_huifei_de_muma_S183.wav	tɕendɤre, kɯki tɤru ɯ-tɕɯ nɯ kɯ, rɟɤlpu ɯ-tɕɯ nɯ kɯ, spoz ra to-zwɤr tɕe, iɕqha tɕheme nɯ chondɤre mbro nɯnɯ ko-fskɤr /nɤ/, ʁnɯ-tɤxɯr ko-fskɤr.
hist140515_congming_de_wusui_xiaohai_S099.wav	"ci nɯra kɯ ""pɯ-ŋu, nɯra tɤ-nɯkrɤz-i pɯ-ŋu"" to-ti-nɯ."
hist140506_nongfu_he_mogui_S090.wav	tɤ-rga kɯ kha jo-nɯɕe tu-kɯ-ti ɲɯ-ŋu.
hist-05-paR_S011.wav	li gongyeyuan liaojie ɲɯŋu lo ma
hist-12-Zmbroko_S040.wav	ndʑɯrwɯz nɯnɯ li nɤkinɯ, 
hist-30-mboR_S084.wav	ɕɤnthɤβ nɯnɯ tɕhi kɯ-fse nɯ ŋu mɤxsi, nɯnɯ ɕɤnthɤβ nɯnɯ
hist140510_fengwang_S003.wav	nɯra nɯ-rɟɤlpu nɯ ɣɯ, nɤki iɕqha nɯ, ɯ-tɕɯ χsɯm pjɤ-tu.
hist-12-ndZiNgri_S136.wav	tɕe nɯ ɯ-prɤm pjɯ́-wɣ-lɤt tɕe
hist-23-mbrAZWm_S206.wav	kupa ra kɯnɤ tu-nɯ-ndza-nɯ ɲɯ-ɕti rca ma ju-ɣɯt-nɯ ɲɯ-ŋu.
hist-05-qaZo_S005.wav	tɕe zrɤβ apɯtu koʁmɯz nɤ tshɤnmu chɤrɤpɯ tɕe nɯ ɲɯ-mphɯl ra 
hist-25-rtChWRjW_S043.wav	li rŋgɯ ɯ-pa ri tu-ɲɟoʁ qhe nɯ ɯ-ŋgɯ ri ku-rɤʑi tɕe,
hist140514_xizajiang_he_lifashi_S035.wav	tɕe nɯ ɯ-qhu qhe, tɕe jier nɯnɯ ɣɯ, nɤkinɯ, ɯ-tɯtsɣe ra wuma ʑo pjɤ-khɯ matɕi,
hist-07-deluge_S113.wav	nɯ ndʑi-rɟit nɯra chɤ-rɤrɟit-nɯ, nɯ kɯ-fse ɲɤ-k-ɤmphɯmphri-ci qhe,
hist140430_lang_he_qizhi_xiaoshanyang_S112.wav	"tɕe a-pi ra kɤsɯfse ʑo, nɤki, spjaŋkɯ kɯ ta-ndza ɕti"" to-ti ɲɯ-ŋu."
hist-21-jmAGni_S086.wav	kɯ-me nɯra qhe me, 
hist-19-RloNbutChi_S009.wav	ma nɯnɯ kú-wɣ-rtoʁ rcanɯ, 
hist-14-sWNgWJu_S156.wav	tú-wɣ-χɕoʁ ɲɯ-khɯ. 
hist-15-babW_S008.wav	woja, nɯ cho nɤ, ɯ-jwaʁ cho nɤ naχtɕɯɣ ri,
hist140501_jingli_tshering_skyid_S048.wav	tɕe mbarkhom kɯ-rɤβzjoz thɯ-ɣe-a, 
hist140513_mutong_de_disheng_S024.wav	ɯkɯki tɤpɤtso kɯ rcanɯ, maka ʑo mɯ́j-sɯxtɕhaʁ tɕe
hist140428_mtshalu_kAsAla_S009.wav	tɯ-jaʁ kú-wɣ-tshoʁ qhe tɯ-jaʁ ku-mtsɯɣ ɕti.
hist-18-saCW2_S010.wav	tɕe kɯ-ɤrqhɯrqhi pjɯ-nɯɕɯrɲɟo tɕe, ŋotɕu tu ʑo saχsɤl.
hist140506_woju_guniang_S042.wav	tɕendɤre ɯ-fso tɕe tɕeri, mɤʑɯ ʑo tu-ndze ɲɯ-sɯsɤm pjɤ-ɕti.
hist-X1-qachGa_S027.wav	"""lɤ-tɯ-ɤri tɕe, tɤte, kɯ-rɯru xcat ʑo ɕti,"
hist140511_alading_yu_shendeng_S163.wav	tɤtʂu nɯ ɲɯ-pɕiz-a tɕe a-tɯ-ɤχsɯko /ɲɯ/
hist-09-mi_S034.wav	tɕe nɯnɯ mi ŋu. (205)
hist140521_huangdi_de_xinzhuang_S080.wav	tɕendɤre, iɕqha kɯ-taʁ nɯni kɯ kɯki iɕqha nɯ, li ʑɯmkhɤm ʑo rŋɯl chondɤre pɕawtsɯ chondɤre nɤkinɯ, koxtɕinri χsɤr nɯra ɲɤ-nɯ-mɟa-ndʑi.
hist-27-tApGi_S130.wav	tɯ-ɕɣa kɯ-nɯsmɤn, tɕɤthi, ndɯchu kɯreri rɤʑi ma,
hist-14-tApitaRi_S124.wav	a-ʁi tɤ-tɕɯ stu kɯ-wxti nɯ ŋu
hist-15-babW_S034.wav	kɯ-ɤqarŋɯrŋe kɯ-fse ci ɲɯ-βze ŋu tɕe tɕe ʑɯrɯʑɤri tɕe pjɯ-khrɯ tɕe pjɯ-ŋgra ŋu tɕe, tɕe ɯ-sta nɯnɯ ɯ-mat ɲɯ-βze ŋu.
hist140522_Kamnyu_zgo_S304.wav	nɯnɯ ɯ-ndɤcu tsa ri ŋu tɕe,
hist140430_yufu_he_tade_qizi_S064.wav	"""bimuyu nɤʑo a-rju ɯ-pɯ-tɯ-mtshɤm tɕe, tɤ-nɯɬoʁ ma"
hist140511_alading_yu_shendeng_S130.wav	pjɤ-ja qhe kɤ-nɯɬoʁ mɯ-ɲɤ-khɯ qhe tɕendɤre 
hist140520_xiaoyida_de_huar_S043.wav	"tɕendɤre ɯ-zda slama nɯ kɯ ""wo nɯnɯra, lonba ʑo, nɤkinɯ, rɟɤlsa ɯ-ŋgɯ jo-ɕe-nɯ."" to-ti."
hist-19-qachGamWntoR_S110.wav	ɯ-mɯntoʁ ɯ-spa tu-kɯ-ɬoʁ nɯnɯ, rɟɤskhi...
hist140522_GJW_S015.wav	tɕe kɯ-ɤβʑɯrdu qhe, tɕe ɯ-qa nɯra hanɯni ɲɯ-jpum,
hist-26-NalitCaRmbWm_S039.wav	kɤ-nɯkho tɕe tɕe 
hist-19-GzW_S057.wav	ɯ-tshɤt tu-sɯβzu-nɯ mɯ́j-khɯ ma,
hist140516_zaixiang_he_candou_S051.wav	tɯ-rʑaʁ tɕe tɕendɤre wuma ʑo tɯ-mɯ qale kɯ-thɯ ʑo ɣɯ tɯrmɯ ciz jo-zɣɯt tɕendɤre, 
hist-30-Com_S105.wav	tɯthɯ pɕoʁ nɯ kɤ-ntɕhoz mɯ́j-pe
hist-27-tApGi_S047.wav	tɯ-ɣmba ɯ-phaʁ ra tu-ɕɯ-mŋɤm, 
hist140430_jin_e_S052.wav	ɕkɤrnɤɕkɤr ʑo, nɤki, ʑɤwu tɯ-ŋke jo-tsɯm tɕe kha jo-nɯɕe tɕe, to-sɯ-mphɯr pjɤ-ra. 
hist-30-macha_S036.wav	tɕe nɯnɯ kɯ-fse kú-wɣ-tshi ŋgrɤl
hist-31-deluge_S085.wav	mɤ-jɤɣ ma fse raŋ tɕe, atu tɕe rcanɯ, kɯ-sɤɕkɯɕke ʑo tu mɤ-tɯ-cha,
hist140512_alibaba_S048.wav	tɕendɤre ɯ-kɯm chɤ-tɕɤt tɕe tɕendɤre,
hist140510_sanpian_sheye_S058.wav	tɕe tɕhi jamar ʑo to-nnɯ-tsu kɯma, li tɤ-rʑaʁ kɯ-nɤkɤro ɲɤ-ɕe ma,
hist140429_qingwa_wangzi_S075.wav	"""nɯra kɯ-ra me"" ɲɯ-sɯsɤm pjɤ-ɕti qhe,"
hist-30-komAr_S047.wav	nɤki, komɤr tu-ɕe ra, konaʁ tu-ɕe ra
hist-14-tasa_S007.wav	tɕe nɯnɯ tasa ɣɯ ɯ-rɣi nɯnɯ sɤtɕha wuma ʑo kɯ-sna,
hist-13-tCamu_S027.wav	kɯɕɯŋgɯ tɕe, tʂha pɯ-rkɯn, pjɤ-me tɕe,
hist140510_fengwang_S059.wav	tɕeri ɲɤ-ɕar-nɯ ri, rɟɤlsa ɣɯ ɯ-kɯm cho ɯ-khɯɣɲɟɯ nɯ lonba ʑo pjɤ-k-ɤpa-ci boʁboʁ ʑo ɕti. 
hist140514_guowang_he_lieying_S037.wav	tɤ-lu ʑo pjɤ-fse.
hist140427_qala_kWrtsAG_S072.wav	nɯ maʁ nɤ ɣɯ-ndza pjɤ-ŋu.
hist140516_huli_de_baofu_S117.wav	ɯʑo to-ʑɣɤsɤstɤko qhe, tɕe qachɣa nɯ to-mtsaʁ qhendɤre,
hist-28-qapar_S226.wav	ɯʑo pha ɯ-phoŋbu ʑo kɯ-wɣrum qhe, ɯ-βri nɯ aʁɤndɯndɤt ʑo kɯ-ɤrtɯm kɯ-fse xɯrxɯr,
hist140505_liuhaohan_zoubian_tianxia_S045.wav	li tɯtɯrca jo-ɕe-nɯ.
hist140522_Kamnyu_tWji_S033.wav	ɯ-qa nɯnɯ paʁ pjɯ-mbi-nɯ.
hist-17-xCAj_S092.wav	tɕe nɯnɯ ŋu tɕe, ɯ-mɯntoʁ nɯnɯ ɯ-ku ri tu-ɣi tɕe, ɯ-mɯntoʁ nɯ kɯ-wɣrum ɲɯ-lɤt ŋu.
hist-03-hehua_S013.wav	nɯnɯ boʁboʁ ʑo kɯ-pa nɯnɯ ɲɯ-ŋu tɕe, (ideoph)
hist140514_guowang_he_lieying_S055.wav	tɕe mbro nɯ kɯ pɤjku pjɯ-tshi mɯ-pjɤ-tsu ma
hist-03-zhenzhuquan1_S012.wav	mɯntoʁ wuma ɲɯ-dɤn.
hist140522_Kamnyu_tshupa_S061.wav	tɕe tɤtsoʁsta nɯ ɲɯ-ɕe tɕe, tɕendɤre, iɕqha,
hist140517_mogui_de_jing_S025.wav	tɕe nɯ nɤ-fkur nɯ tɯ-sŋi sɤz tɯ-sŋi/a/ a-tɤ-ʑo tɕe tɕendɤre,
hist140426_buxiejiang_gaizuo_yisheng_S021.wav	kɯki tɯ-xtsa ɯ-kɯ-ɣɤβdi ɣɯ smɤn tɤ-kɤ-βzu tɕe 
hist-18-qromJoR_S059.wav	tɕe nɯ maldo ŋu.
hist140512_alibaba_S288.wav	ci nɯ ɯ-sci ɲɯ-mgrɯn pjɤ-ɕti ri, 
hist-27-tWfCAl_S115.wav	nɯreri tɕhɯwur tu-rke ŋu tɕe, 
hist-27-kikakCi_S096.wav	ɯ-phoŋbu nɯ pjɯ-rtɤβ kɯ-fse qhe, kɯ-ɲaʁ ntsɯ pjɯ-rtɤβ qhe,
hist140504_baixue_gongzhu_S234.wav	iɕqha ɯ-ɬaʁ nɯnɯ kɯ nɯra pɯ-kɯ-fse nɯra pa-sɯz tɕe tɕendɤre
hist-14-tApitaRi_S062.wav	tɕe nɯŋa pjɯχse, paʁ pjɯχse, tshɤt pjɯχse 
hist-X1-tWJo_S049.wav	tɕe ɯ-thɤcu nɯtɕu, tɯ-qe stɤɲcrɯɣ lo-nɯɬoʁ tɕe tɕe, nɤki ci nɤ,
hist-31-deluge_S091.wav	tɕendɤre ɯ-fsomɯr qhendɤre, ɯ-fso qhe,
hist140430_jin_e_S020.wav	tɕe sɯŋgɯ jɤ-azɣɯt tɕendɤre iɕqha nɯ,
hist-22-kumpGatCW_S015.wav	ɲɯ-sɤɣʑɯr tɕe, nɯ ɕqraʁ tɕe
hist-13-NAnWkWmtsWG_S008.wav	ɯ-jwaʁ ɯ-qhuchu nɯ ɲɯ-pɣi,
hist140426_buxiejiang_gaizuo_yisheng_S014.wav	tɕendɤre, nɤkinɯ, tɯrme ra kɯ wuma ʑo ɲɤ́-wɣ-nɤstu tɕe ɯ-rmi to-caʁ ɲɯ-ŋu.
hist140427_zhameng_he_maotouying_S046.wav	wuma ʑo ɲɯ-cha ɲɯ-ŋu, ɲɯ-znɤŋɯŋu-nɯ ɲɯ-ŋu tɕe
hist140430_jin_e_S037.wav	tɯrpa ci to-lɤt ri, nɤkinɯ 
hist140514_guowang_he_lieying_S038.wav	tɕendɤre nɯ rɟɤlpu nɯ kɯ, iɕqha nɯ, qaliaʁ ɯ-mke khɯtsa nɯ,
hist-08-CkrAz_S029.wav	tɕe nɯnɯ ɯ-taʁ ɯ-qhucu ri chɯ-ta-nɯ tɕe nɯ ɯ-zɣɯqhu tu-kɯ-ti,
hist-16-RlWmsWsi_S080.wav	paʁɕɤɣ tɕe si ŋu.
hist140518_mao_he_laoshu_S093.wav	tɕeri kɯ-pe tɕe nɯ jamar ʑo tɕe wuma ʑo pɯ-alɯlɤt-ndʑi ɯ-ŋgɯ jamar ri tɕe, 
hist-21-jmAGni_S091.wav	ɕɯrʁaʁ nɯ nɯ ŋu, nɯ fse tɕe, ʁnɯ-tɯphu tu.
hist140428_yonggan_de_xiaocaifeng_S069.wav	tɕeri to-lɤt ri, nɯnɯ pɣɤtɕɯ nɯ to-ɕe tɕe to-nɯqambɯmbjom tɕe
hist-16-RlWmsWsi_S176.wav	ʁnaʁna ʑo kɯ-wxtɯ-wxti tu-βze cha.
hist-28-kWpAz_S065.wav	kɯrnɯ kɤ-ti ci tu.
hist140504_huiguniang_S053.wav	tɕendɤre nɤkinɯ, pɣɤtɕɯ nɯ /kɯ/ chondɤre li ko-kɤmɯfse-ndʑi tɕe βzaŋsa to-nɯpa-ndʑi.
hist140511_xinbada_hanghai_lixianji_S083.wav	tɕe chɤ-nɯɬoʁ tɕe tɕendɤre, xinbada nɯnɯ,
hist140428_mu_e_guniang_S027.wav	tɕendɤre nɤkinɯ, βdaʁmu ɣɯ ɯ-me nɯ tɤ-ʑi nɯnɯ kɯ 
20140429090403_S007.wav	tɕe ɯ-taʁ lú-wɣ-ʑa ŋu.
hist140521_jianding_de_xibing_S161.wav	toʁde qhe, ʁlɤwɯr ʑo qhe rcanɯ, ɕlaʁ ʑo ɲɤ-fsoʁ.
hist-19-RloNbutChi_S041.wav	tɕe ɯ-jme nɯra kɯnɤ, ɯ-jme ɯ-tshɯɣa nɯ paʁ ɯ-jme ɲɯ-fse
hist140520_ye_tiane_S335.wav	"""nɯra tu-rɤru ŋu nɯra /nɯre/ mɯ-pa-mtshɤm ŋu"" ɲɯ-sɯsɤm pjɤ-ɕti."
hist140510_rkoNJAl_S045.wav	nɯ-rpi kɯ-ɴqɯ-ɴqa ʑo to-rɯrɤt-nɯ. 
hist-30-macha_S013.wav	gangjinguo kɯ-fse naʁlo kɯ-fse ra tʂha ku-nɯ-ta-nɯ pɯ-ŋgrɤl
hist140521_jianding_de_xibing_S195.wav	qandʑi kɯ-xtɕɯ-xtɕi ci kɯ-ɤrtɯm ci rloʁrloʁ ɲɤ-k-ɤβzu-ci ma nɯ ma ɲɤ-me
hist-26-ndzWrnaR_S025.wav	nɯnɯ wuma ɲɯ-ɤɣɯtɯɣ.
hist-19-GzW_S059.wav	tɕendɤre ɯ-xtɤtshɤt maŋe tɕe,
hist140521_jianding_de_xibing_S101.wav	tɕe nɯ tɯ-ci nɯnɯ iɕqha, 
hist140510_sanpian_yumao_S017.wav	tɯ-rdoʁ nɯnɯ ʁmbɣi ɯ-sɤ-ɕqhlɤt nɯ tɕu ɲɤ-ɕqhlɤt.
hist-16-CWrNGo_S145.wav	tu-mbro tɕe ʁnɯ-rtsɤɣ, χsɤ-rtsɤɣ jamar tu-mbro ɲɯ-cha ri,
hist-30-mphrWG_S031.wav	mphrɯɣ tɕhɤrʁɯ tu-kɯ-ti,
hist140505_xiaohaitu_S136.wav	tɕendɤre iɕqha qachɣa cho nɤkinɯ ɲɤ-ʑɣɤsɤβzu-ndʑi.
hist-23-RmWrcWftsa_S034.wav	tɕe nɯnɯ qalekɯtshi nɯnɯ, tu-kɯ-ru tɕe,
hist-26-qambalWla_S056.wav	tɕeri ɯ-mɤlɤjaʁ ɣɤʑu tɕe,
hist140514_xiee_de_shewang_S018.wav	iɕqha ɬɤndʐi nɯ kɯ mɤʑɯ ʑo, tɕe nɯnɯ kɯ, nɤki, ɯ-kɯ-nɯkhamu lo-ndo.
hist140520_ye_tiane_S184.wav	nɤʑo nɤ-pi kɤ-fsraŋ, nɤkinɯ, tɯ-cha ɕti,
hist140516_yiguan_ganlan_S021.wav	kɯ-mdʑɤl, meijia tu-kɤ-ti nɯtɕu kɯ-mdʑɤl ju-ɕe-a ɲɯ-sɯsam-a tɕe,
hist-31-qala_S013.wav	"""wo ɲɯ-phɤn nɤ"" to-ti tɕe,"
hist140518_jinyin_chengbao_S097.wav	tɕe nɯra kɤ-nɤma ra nɯ-jɤɣ tɕe tɕendɤre, 
hist-28-qapar_S073.wav	ɯ-mdoʁ nɯ kɯ-pɣi tɕe kɯ-ɤɲaʁndzɯm tsa ŋu tɕe,
hist-21-lWlu_S024.wav	tɕe lɯlu nɯnɯ ʑakastaka ʑo ɯ-mdoʁ tu cho lɯlu sɤjndɤt.
hist140520_ye_tiane_S130.wav	ji-wa ju-nɤrɯra-j, ɯ-rɟɤlsa ra ju-ru-j, pjɯ-mto-j ma nɯ ma,
hist140514_huishuohua_de_niao_S219.wav	nɯnɯ ɣɯ ɯ-jwaʁ nɯ, qale a-jɤ-ɣi tɕendɤre, 
hist-12-kAtsxWB_S060.wav	ɯ-pɕima kɤ-ti tu, ɯ-naŋma kɤ-ti tu, ɯ-poloʁ kɤ-ti tu.
hist-18-NGolo_S059.wav	ɯnɯnɯ wuma ʑo aɣɯmdzu.
hist-18-qromJoR_S023.wav	sɤtɕha kɯ-mpja tsa ri tu-ɬoʁ ŋu.
hist-18-qromJoR_S153.wav	nɯnɯ ɯ-mat nɯ ɣɯ ɯ-βri nɯra kɯnɤ,
hist-13-xsArW_S027.wav	ɯ-jwaʁ nɯ kɯ-ɤrtɯrtɯm ʑo tɕe, kɯ-ndɯ-ndɯβ ʑo kɯ-ɤrtɯrtɯm ʑo ŋu.
hist-28-smAnmi_S335.wav	"ɯ-taʁ nɯ tɕu, sɯrna ʁnɯz nɯ a-nɯ-tɯ-ɣɤntaβ"" to-ti."
